name,description,category,brand,price,old_price,stock,image,is_available,is_featured
Design Product,Social very pay.,Beauty,Nike,1323,1474,26,img258.jpg,False,False
Water Product,Standard sport particularly big wrong lay.,Electronics,Nike,2554,2576,41,img259.jpg,True,False
Minute Product,Federal view bill under drug region.,Electronics,Nike,985,1140,38,img260.jpg,False,True
Which Product,Nearly score modern account investment you.,Electronics,Generic,2701,2863,42,img261.jpg,False,False
Total Product,Explain stop detail hope.,Sports,Adidas,2518,2575,23,img262.jpg,True,True
Not Product,Including three rather magazine.,Clothing,Nike,1042,1072,39,img263.jpg,True,False
First Product,Stop sister election federal attorney late here.,Beauty,Apple,2027,2045,15,img264.jpg,False,True
Leave Product,Child you above attack weight medical.,Beauty,Samsung,2222,2294,33,img265.jpg,True,False
Present Product,Force change majority.,Beauty,Samsung,1631,1643,30,img266.jpg,True,False
Entire Product,Finish million with prove sort.,Electronics,Samsung,866,1021,12,img267.jpg,False,False
Big Product,Sense food computer but doctor race.,Home,Apple,386,410,13,img268.jpg,True,False
Billion Product,Industry glass table state senior manage.,Sports,Adidas,348,472,32,img269.jpg,False,True
Glass Product,Argue study build thus.,Sports,Samsung,857,945,11,img270.jpg,False,True
Hot Product,Only somebody author line claim.,Electronics,Apple,640,838,1,img271.jpg,False,True
Low Product,Pick move create this.,Home,Samsung,2832,2852,45,img272.jpg,True,True
Sea Product,Which poor become compare.,Clothing,Generic,2848,2942,20,img273.jpg,False,False
Shake Product,Section plan recognize.,Home,Generic,217,316,31,img274.jpg,True,False
Thank Product,Civil energy specific goal.,Clothing,Samsung,66,197,33,img275.jpg,True,True
Since Product,Inside east common cost case together start.,Sports,Apple,1805,1959,0,img276.jpg,True,False
Act Product,Continue argue amount baby.,Beauty,Nike,416,431,7,img277.jpg,False,False
Summer Product,Free oil behavior.,Beauty,Samsung,1476,1580,49,img278.jpg,True,True
Partner Product,Check food same contain central dark marriage season.,Sports,Samsung,448,491,3,img279.jpg,True,False
Against Product,Job measure information exactly.,Beauty,Apple,2733,2805,20,img280.jpg,False,False
Future Product,Of include whose manager night trouble.,Electronics,Nike,1378,1438,18,img281.jpg,False,True
Nearly Product,May way wife establish age fear shake.,Home,Generic,2165,2347,32,img282.jpg,True,False
Become Product,Newspaper stay water color.,Sports,Generic,1501,1681,48,img283.jpg,True,False
Every Product,Direction policy vote century.,Beauty,Apple,2947,3004,5,img284.jpg,False,False
Usually Product,Not mouth front newspaper foot age.,Electronics,Samsung,836,1024,22,img285.jpg,True,True
Statement Product,Listen play answer bag yeah memory economic.,Home,Generic,1239,1303,48,img286.jpg,False,True
Research Product,Rule glass large group accept go.,Electronics,Apple,1605,1683,3,img287.jpg,True,True
Put Product,Travel character position list radio adult box.,Home,Apple,1820,1889,13,img288.jpg,False,False
Cup Product,Alone join or house also page report.,Clothing,Apple,922,1118,35,img289.jpg,False,False
Cultural Product,Popular let again wonder appear.,Beauty,Nike,214,244,34,img290.jpg,True,True
Choice Product,Party line major simple much research kid.,Beauty,Apple,2538,2672,41,img291.jpg,False,False
Crime Product,Television natural foreign site mention lay.,Beauty,Apple,1918,1947,3,img292.jpg,False,False
Wonder Product,Me customer prove billion air nation somebody.,Clothing,Samsung,93,117,15,img293.jpg,True,True
Happy Product,Avoid doctor share any system old.,Beauty,Adidas,189,241,45,img294.jpg,True,False
Shake Product,Itself father table nice these history sing.,Home,Adidas,1966,1990,28,img295.jpg,True,True
Current Product,Especially bed sell democratic operation company bar.,Beauty,Nike,2059,2194,15,img296.jpg,False,True
Buy Product,Listen away produce federal.,Electronics,Generic,546,628,24,img297.jpg,True,False
Box Product,True few point reflect.,Electronics,Apple,2590,2773,9,img298.jpg,False,False
They Product,Own not benefit north moment analysis.,Clothing,Apple,1447,1506,20,img299.jpg,True,False
Note Product,Figure reduce exist education.,Beauty,Adidas,2824,2938,48,img300.jpg,False,True
Speak Product,So wonder himself war interesting.,Electronics,Generic,629,798,1,img301.jpg,True,True
Even Product,Expect or several cover floor.,Beauty,Nike,2979,3001,0,img302.jpg,False,False
Claim Product,Election nothing anyone write level trial.,Electronics,Apple,1000,1123,24,img303.jpg,True,True
Chair Product,According prepare ok phone find see relationship.,Clothing,Apple,1838,1903,30,img304.jpg,True,False
Safe Product,Check win think something where figure.,Sports,Samsung,2818,2908,39,img305.jpg,True,True
Arm Product,Operation group day office place bring.,Sports,Adidas,1176,1339,11,img306.jpg,False,True
Detail Product,Consider professional performance front level.,Electronics,Apple,2381,2572,41,img307.jpg,True,False
Early Product,Response music meeting and.,Home,Adidas,973,1173,12,img308.jpg,True,True
Learn Product,Mind like candidate change across nor degree cause.,Electronics,Nike,98,247,45,img309.jpg,True,False
Clear Product,Between spring yard majority available yeah box.,Electronics,Samsung,2714,2789,39,img310.jpg,False,False
Sea Product,Join first attorney each foreign report outside.,Beauty,Apple,2792,2825,6,img311.jpg,False,False
South Product,Ahead teacher avoid begin quite throughout economy.,Beauty,Samsung,659,786,14,img312.jpg,False,True
Hot Product,Specific trip improve two guess throughout.,Sports,Adidas,1051,1172,37,img313.jpg,True,True
Current Product,With catch then Mr.,Clothing,Samsung,1266,1448,38,img314.jpg,False,False
Between Product,Serve suddenly into.,Sports,Apple,2013,2077,10,img315.jpg,False,True
Low Product,Owner specific PM spring.,Sports,Apple,72,193,11,img316.jpg,False,True
Music Product,Drive option difference beyond.,Sports,Adidas,1131,1196,36,img317.jpg,False,False
Grow Product,Example great bad control discussion.,Home,Generic,641,755,35,img318.jpg,True,False
Grow Product,Travel against also then as national.,Home,Apple,2617,2739,46,img319.jpg,False,True
Knowledge Product,Thank better as stop guy.,Clothing,Nike,247,279,34,img320.jpg,True,True
Town Product,Picture appear back together hear method.,Electronics,Nike,1407,1567,4,img321.jpg,True,True
End Product,Country father word local also wait.,Electronics,Generic,703,755,36,img322.jpg,False,True
Record Product,Hundred south would evening.,Clothing,Generic,924,996,4,img323.jpg,True,False
Forward Product,Every draw high member not.,Sports,Nike,1931,1945,6,img324.jpg,False,True
Two Product,Central suddenly heavy American never think.,Home,Adidas,131,234,13,img325.jpg,False,False
Republican Product,Believe five cup mission pay.,Beauty,Apple,642,833,2,img326.jpg,True,False
Garden Product,Assume news attack listen western factor.,Electronics,Nike,1051,1153,47,img327.jpg,True,False
Set Product,Their describe baby lead.,Beauty,Nike,1685,1802,7,img328.jpg,False,False
Fly Product,Successful assume serve including main table may choice.,Clothing,Apple,1005,1179,28,img329.jpg,False,False
Establish Product,Be American throw significant walk officer second own.,Beauty,Apple,1392,1432,50,img330.jpg,True,False
Whatever Product,Film individual bill agent notice anything.,Clothing,Adidas,1452,1540,33,img331.jpg,False,False
Scene Product,Move hold recognize way reach.,Sports,Nike,882,1050,6,img332.jpg,False,True
Address Product,Also game meeting investment.,Beauty,Nike,1836,1875,29,img333.jpg,True,False
Type Product,Respond much suffer student first product happen yard.,Home,Apple,930,956,25,img334.jpg,True,False
Lose Product,Drop happen wind either fly necessary out small.,Electronics,Apple,551,576,8,img335.jpg,False,True
My Product,Series PM game effect race phone parent.,Beauty,Adidas,538,650,19,img336.jpg,False,False
Finish Product,Activity by large can.,Beauty,Nike,2361,2402,15,img337.jpg,True,True
Teacher Product,Option full center analysis either system.,Electronics,Nike,2281,2474,50,img338.jpg,True,True
Start Product,Suffer fish general.,Beauty,Samsung,1596,1672,43,img339.jpg,False,True
Ago Product,Game certainly think seem around budget.,Sports,Generic,2418,2492,47,img340.jpg,False,True
Others Product,A act miss smile as medical.,Beauty,Samsung,1982,1995,6,img341.jpg,False,False
Modern Product,Suffer improve society mind support air answer.,Sports,Samsung,2041,2224,6,img342.jpg,True,False
Drop Product,Part show evening information necessary describe.,Sports,Nike,1094,1203,36,img343.jpg,True,False
My Product,Represent any project address too town everyone.,Home,Apple,520,680,44,img344.jpg,True,False
Night Product,Century class control government.,Sports,Adidas,1813,1914,34,img345.jpg,True,True
Others Product,Another report management send half off.,Beauty,Generic,351,471,44,img346.jpg,True,True
Partner Product,Direction value defense us.,Beauty,Apple,1633,1660,17,img347.jpg,False,False
Miss Product,Guy citizen sell health talk water.,Home,Generic,931,1042,41,img348.jpg,False,False
Major Product,Way side focus close father whom involve perhaps.,Clothing,Generic,1006,1156,7,img349.jpg,True,True
Establish Product,Major none term show.,Home,Samsung,1856,1910,14,img350.jpg,True,True
Consider Product,Last effort case range a speech music.,Home,Samsung,540,711,31,img351.jpg,True,False
After Product,Money because sport report.,Home,Adidas,1090,1129,6,img352.jpg,True,True
Defense Product,All resource finish white character so foreign.,Home,Adidas,946,989,30,img353.jpg,False,False
Red Product,Foot fish meeting it box.,Clothing,Nike,492,629,23,img354.jpg,False,False
Design Product,Series animal build thank require.,Sports,Nike,1856,1912,50,img355.jpg,False,True
Training Product,Field her community.,Beauty,Generic,1139,1290,46,img356.jpg,False,False
Of Product,Generation throughout admit key brother sister Mr argue.,Home,Adidas,1065,1197,24,img357.jpg,True,False
Detail Product,My already skill true.,Clothing,Samsung,1745,1773,32,img358.jpg,False,True
Report Product,Stage amount all sure join his.,Clothing,Adidas,2570,2625,43,img359.jpg,False,False
Although Product,Democrat program here structure.,Electronics,Nike,1829,1988,32,img360.jpg,False,True
Reduce Product,Give if fight area success.,Clothing,Generic,2415,2454,8,img361.jpg,True,False
Democratic Product,Front career theory lead however begin.,Electronics,Apple,194,375,17,img362.jpg,False,False
Must Product,Computer common third blood after market similar everything.,Sports,Generic,1645,1722,20,img363.jpg,False,False
Decide Product,Night painting television majority.,Clothing,Apple,190,260,30,img364.jpg,True,True
Truth Product,Thought of each growth feel.,Sports,Generic,2782,2922,8,img365.jpg,True,True
Site Product,Serious hand according skin without every.,Electronics,Apple,1165,1266,25,img366.jpg,False,False
Weight Product,Very home job town chance.,Sports,Samsung,672,803,23,img367.jpg,True,True
Have Product,Spend lawyer either audience within trip wind.,Clothing,Generic,2070,2161,46,img368.jpg,True,False
Whose Product,Reason collection raise attention scene off bit behind.,Home,Generic,1879,2058,22,img369.jpg,False,True
Article Product,Reality hand often appear.,Sports,Nike,2595,2624,22,img370.jpg,True,True
Letter Product,Record skin build recognize agent order.,Sports,Apple,2648,2709,25,img371.jpg,True,True
Animal Product,Every value according outside lawyer memory.,Beauty,Nike,2131,2313,11,img372.jpg,True,True
Pass Product,Also court night score these try.,Beauty,Adidas,1979,2177,3,img373.jpg,True,True
Foot Product,Chance hospital system to.,Electronics,Adidas,2311,2373,35,img374.jpg,False,False
Career Product,All nor business able south conference.,Clothing,Generic,1584,1688,47,img375.jpg,True,False
Middle Product,Each gun look special personal customer travel reason.,Home,Nike,1177,1257,44,img376.jpg,False,True
Me Product,Huge cost address it once relationship anything since.,Electronics,Nike,2761,2835,21,img377.jpg,True,True
Standard Product,Democratic someone summer hear prepare available least.,Home,Generic,1042,1144,1,img378.jpg,True,True
Myself Product,Program maintain television might.,Clothing,Samsung,2078,2158,44,img379.jpg,True,True
Particular Product,Share century sport accept past western significant note.,Home,Apple,2681,2846,48,img380.jpg,True,True
Program Product,Develop find put movement week quality.,Sports,Generic,1748,1782,29,img381.jpg,True,True
Us Product,Spring degree door gas accept town person.,Sports,Generic,1976,2142,9,img382.jpg,False,False
Guy Product,Feeling off leader no him.,Beauty,Nike,1486,1557,32,img383.jpg,False,False
Parent Product,We view avoid eat.,Beauty,Adidas,1479,1517,10,img384.jpg,False,False
Girl Product,Court market kid return main.,Clothing,Adidas,2995,3139,47,img385.jpg,True,False
By Product,No half conference blood case sort result.,Beauty,Samsung,1009,1048,39,img386.jpg,False,False
Check Product,Choose guy benefit difficult.,Home,Adidas,463,663,29,img387.jpg,True,False
Agree Product,During investment best several find.,Electronics,Generic,341,538,41,img388.jpg,True,False
Civil Product,Media door may.,Sports,Nike,1898,1961,3,img389.jpg,False,False
Per Product,Size lead per other raise cut.,Home,Adidas,2451,2628,34,img390.jpg,True,False
Area Product,Carry camera order sell.,Home,Samsung,1796,1852,46,img391.jpg,False,True
Range Product,How care continue bad.,Electronics,Generic,413,446,11,img392.jpg,False,True
Nor Product,Understand front team campaign sea wall interesting air.,Beauty,Adidas,91,157,46,img393.jpg,True,True
Where Product,Pm law part identify off picture surface final.,Home,Adidas,1436,1573,4,img394.jpg,True,False
Wrong Product,From economic represent change another training.,Electronics,Apple,90,250,19,img395.jpg,False,False
During Product,Decide shake his phone thousand.,Beauty,Adidas,2930,3087,20,img396.jpg,True,False
Road Product,Never significant particular design we behavior wind first.,Beauty,Generic,1623,1713,38,img397.jpg,True,True
Project Product,Understand position drop money visit.,Clothing,Adidas,637,813,34,img398.jpg,True,False
Everything Product,Rest run thought easy imagine.,Sports,Adidas,1517,1527,0,img399.jpg,True,False
Light Product,Situation chance research meeting will.,Beauty,Adidas,1261,1425,38,img400.jpg,False,False
Condition Product,Make least simply no fire thus.,Beauty,Adidas,460,624,0,img401.jpg,True,True
Campaign Product,Young treat leg keep PM.,Home,Samsung,218,237,40,img402.jpg,True,True
Feel Product,Rate per college next.,Home,Adidas,346,437,44,img403.jpg,False,False
Hold Product,Box attack show.,Electronics,Generic,2784,2943,37,img404.jpg,False,True
Only Product,Thing high share third business allow laugh.,Electronics,Apple,2659,2671,8,img405.jpg,False,False
Including Product,Hit energy result.,Electronics,Adidas,2413,2576,48,img406.jpg,False,True
Attack Product,True bank today plan movement.,Electronics,Generic,728,868,25,img407.jpg,True,False
Cell Product,Law character give skill describe.,Home,Generic,2586,2633,24,img408.jpg,True,False
Despite Product,Economic pay hope cause easy happy.,Electronics,Adidas,1251,1302,19,img409.jpg,False,False
Hear Product,Half throughout meet.,Electronics,Nike,1688,1714,7,img410.jpg,True,True
If Product,Chair system season guy character figure stay make.,Sports,Generic,175,332,33,img411.jpg,False,False
Throw Product,Executive sound husband too affect central them sometimes.,Electronics,Nike,2784,2886,18,img412.jpg,True,True
Worry Product,Collection wear community church hour federal system.,Sports,Nike,387,413,10,img413.jpg,True,True
Capital Product,Capital discover company save site.,Home,Generic,1628,1641,25,img414.jpg,True,False
Item Product,Walk decision person light threat present officer.,Electronics,Samsung,661,767,10,img415.jpg,True,False
Play Product,Car buy many behind military.,Sports,Apple,2424,2512,42,img416.jpg,False,True
Scene Product,Across body clearly doctor.,Electronics,Samsung,201,313,32,img417.jpg,True,False
Chair Product,Bad score service social issue deep.,Sports,Nike,2530,2659,43,img418.jpg,True,False
Maintain Product,Standard week exist catch.,Sports,Apple,1065,1137,25,img419.jpg,True,True
Water Product,Relationship develop news treat.,Home,Nike,1069,1079,24,img420.jpg,True,False
Including Product,Life hit report national beyond American standard.,Clothing,Nike,1421,1566,19,img421.jpg,True,False
Store Product,Half push necessary receive result.,Electronics,Generic,623,702,21,img422.jpg,True,False
Mean Product,Themselves act result evening Republican movement author.,Clothing,Adidas,2674,2746,12,img423.jpg,False,True
Citizen Product,Up sense yet relationship.,Beauty,Adidas,1874,1900,36,img424.jpg,True,True
Event Product,Quite necessary mind go.,Clothing,Samsung,616,639,2,img425.jpg,True,False
Them Product,Half week yourself news.,Home,Samsung,273,468,6,img426.jpg,False,True
Represent Product,Including wear peace middle number Republican.,Clothing,Generic,2953,3147,37,img427.jpg,False,False
Within Product,Must between her place fly.,Sports,Samsung,249,361,13,img428.jpg,True,True
Show Product,Notice power produce.,Electronics,Samsung,369,401,40,img429.jpg,False,True
Eight Product,Director deep year simple.,Clothing,Nike,462,472,46,img430.jpg,False,False
Ability Product,After manager example state explain head.,Sports,Generic,426,460,20,img431.jpg,True,True
However Product,Develop military challenge.,Electronics,Samsung,2742,2780,43,img432.jpg,True,False
Carry Product,Pull three simply cut star whether.,Clothing,Adidas,2019,2150,35,img433.jpg,False,True
Itself Product,Book effort raise style successful theory.,Electronics,Apple,2128,2187,26,img434.jpg,True,False
Degree Product,Ground trouble view there.,Sports,Apple,477,627,0,img435.jpg,True,False
Western Product,Oil live open.,Clothing,Apple,2665,2810,29,img436.jpg,True,True
There Product,Bank step quality beyond throw class.,Electronics,Samsung,2280,2443,15,img437.jpg,True,False
Production Product,Commercial including person.,Electronics,Adidas,294,432,6,img438.jpg,False,True
Impact Product,Person series method camera.,Sports,Nike,1307,1427,13,img439.jpg,False,True
Require Product,Main least great threat.,Sports,Nike,2176,2195,36,img440.jpg,True,True
Career Product,Job page treatment.,Electronics,Adidas,1604,1768,33,img441.jpg,False,False
Describe Product,Could positive nature light well decision four.,Sports,Samsung,2154,2231,48,img442.jpg,True,True
Great Product,Scientist community eat citizen nearly recognize speak.,Clothing,Generic,579,755,20,img443.jpg,False,True
Answer Product,Compare nature around.,Beauty,Generic,748,771,24,img444.jpg,True,True
Listen Product,Movement option tonight eye real civil.,Electronics,Apple,1719,1859,39,img445.jpg,True,True
Summer Product,Door pick born them.,Clothing,Apple,1155,1291,10,img446.jpg,False,False
Perform Product,In travel manage beyond.,Clothing,Adidas,1073,1171,17,img447.jpg,True,True
Figure Product,Computer peace per population father discover station.,Home,Generic,614,699,31,img448.jpg,True,False
Bank Product,Play small him ball few.,Home,Apple,501,559,47,img449.jpg,True,True
Capital Product,Very need enough.,Clothing,Generic,1072,1140,39,img450.jpg,True,False
Make Product,Peace I run human.,Clothing,Samsung,2333,2425,17,img451.jpg,False,False
How Product,Memory go financial simply arrive never.,Beauty,Nike,2744,2903,23,img452.jpg,False,False
Respond Product,Soon college fish everyone society.,Beauty,Generic,977,1108,6,img453.jpg,False,False
Theory Product,Great eye live important short today discussion.,Home,Samsung,296,485,0,img454.jpg,False,True
Provide Product,Capital phone husband continue customer but notice.,Beauty,Apple,2745,2849,9,img455.jpg,True,False
Tax Product,Church idea condition age ago common.,Clothing,Nike,2169,2183,30,img456.jpg,True,True
Short Product,Official field attention one theory owner.,Electronics,Generic,1935,2015,36,img457.jpg,True,False
Already Product,Service others body toward.,Beauty,Nike,567,590,33,img458.jpg,False,False
May Product,Suffer sell site understand.,Beauty,Generic,1181,1272,16,img459.jpg,True,True
Wish Product,Security arrive believe building.,Clothing,Adidas,2755,2892,40,img460.jpg,True,False
Think Product,Own daughter poor.,Home,Apple,2984,3146,48,img461.jpg,False,True
Discussion Product,Occur set stuff level accept minute low.,Clothing,Generic,346,425,34,img462.jpg,True,False
You Product,Argue care center.,Clothing,Generic,2400,2471,14,img463.jpg,True,True
Yard Product,Town world country whatever.,Clothing,Nike,1937,2046,13,img464.jpg,False,False
Represent Product,Focus travel project.,Clothing,Generic,980,1040,26,img465.jpg,False,False
Shoulder Product,Within young per.,Home,Nike,1633,1793,1,img466.jpg,False,False
Employee Product,Into reach rest modern top story.,Electronics,Adidas,169,317,13,img467.jpg,False,False
At Product,Worry improve house that professor product.,Home,Adidas,2861,2887,2,img468.jpg,True,False
East Product,Point sign admit civil baby although.,Clothing,Apple,2194,2361,42,img469.jpg,False,False
Risk Product,Around occur throughout lead word control bad.,Sports,Samsung,594,781,9,img470.jpg,True,True
Her Product,Allow within ahead peace sister health.,Sports,Nike,1374,1573,8,img471.jpg,False,False
Position Product,Tend tough describe government.,Electronics,Samsung,2291,2394,0,img472.jpg,False,False
Each Product,Nor last table staff.,Electronics,Nike,66,111,30,img473.jpg,True,True
Hundred Product,Apply against eat investment shoulder left difficult.,Beauty,Adidas,371,565,26,img474.jpg,False,False
Any Product,Cultural attack how various.,Clothing,Samsung,132,186,30,img475.jpg,False,False
Simple Product,Defense raise prove surface stock south color.,Home,Nike,2657,2798,11,img476.jpg,False,True
Little Product,Increase weight ten strategy.,Electronics,Generic,2016,2177,28,img477.jpg,False,True
Type Product,Message difficult director many mind thought.,Electronics,Samsung,852,986,39,img478.jpg,False,False
Also Product,But anyone then floor under old.,Electronics,Adidas,2054,2163,33,img479.jpg,True,True
Military Product,Child that production computer opportunity he wish candidate.,Home,Generic,503,653,36,img480.jpg,True,True
Case Product,Opportunity blue may benefit drop usually cut.,Clothing,Nike,1498,1569,15,img481.jpg,True,True
Rise Product,Population sign heavy blood.,Electronics,Generic,70,171,37,img482.jpg,False,False
Worker Product,Money common expect church week responsibility.,Clothing,Nike,167,266,21,img483.jpg,False,False
Carry Product,Arm ago lot worker step.,Home,Nike,1014,1152,6,img484.jpg,False,False
Front Product,Election green daughter nothing once gun house.,Electronics,Adidas,1987,2028,35,img485.jpg,False,False
Wait Product,Question man sound draw.,Sports,Apple,854,984,30,img486.jpg,True,True
Weight Product,Under professor after many help.,Clothing,Generic,245,356,17,img487.jpg,False,False
Rather Product,Player drive discover.,Beauty,Samsung,2693,2802,25,img488.jpg,False,False
Though Product,Real their quality.,Beauty,Generic,2610,2771,43,img489.jpg,False,False
Buy Product,Senior once imagine at among so.,Clothing,Samsung,262,338,31,img490.jpg,True,False
War Product,Have line realize he can picture interesting current.,Beauty,Nike,1597,1657,30,img491.jpg,False,True
Collection Product,Beyond food senior state allow watch factor.,Sports,Adidas,120,215,29,img492.jpg,True,True
No Product,Him would government choice parent.,Beauty,Nike,708,856,38,img493.jpg,False,False
Such Product,South identify short meeting Congress.,Home,Samsung,1129,1241,8,img494.jpg,True,False
Today Product,Wear share you but interesting old leader.,Home,Apple,413,442,22,img495.jpg,False,True
Myself Product,View send beautiful.,Home,Adidas,620,674,4,img496.jpg,False,True
Pass Product,Learn reduce boy site.,Sports,Generic,1675,1777,33,img497.jpg,True,False
His Product,Four loss loss my.,Beauty,Adidas,1687,1715,44,img498.jpg,True,False
Three Product,Agreement evening physical talk play gas last.,Beauty,Generic,283,446,45,img499.jpg,False,True
Score Product,Character person site produce two.,Clothing,Samsung,1522,1608,20,img500.jpg,True,False
Fund Product,Candidate deal would family stage cover American.,Clothing,Generic,956,1118,13,img501.jpg,False,True
South Product,Window stuff movie serious record heavy.,Home,Generic,2063,2243,14,img502.jpg,True,False
South Product,Draw travel push stand early suffer role.,Beauty,Apple,302,452,45,img503.jpg,True,False
Law Product,Boy prove economy light.,Sports,Apple,2163,2204,34,img504.jpg,False,True
Admit Product,World blood charge work recognize describe move.,Electronics,Adidas,1558,1641,36,img505.jpg,False,False
Son Product,Wife store cause address once community.,Electronics,Generic,1636,1677,36,img506.jpg,True,False
Bar Product,Before threat these I general.,Electronics,Nike,1521,1682,47,img507.jpg,True,True
Fast Product,Especially reality thousand mean.,Home,Apple,665,694,28,img508.jpg,True,True
Control Product,Writer actually left between decision everything play.,Clothing,Samsung,1618,1712,0,img509.jpg,False,True
Serve Product,Best together record.,Home,Adidas,1089,1227,6,img510.jpg,True,True
Perform Product,Company look significant Democrat.,Beauty,Adidas,1908,1939,12,img511.jpg,False,True
Sit Product,Miss natural others former manager project.,Home,Apple,2752,2797,24,img512.jpg,False,True
Share Product,Money notice party training fine enter.,Electronics,Nike,1058,1212,30,img513.jpg,False,True
Newspaper Product,Second adult morning move.,Beauty,Adidas,2089,2166,5,img514.jpg,True,False
