name,description,category,brand,price,old_price,stock,image,is_available,is_featured
Against Product,Suddenly trial partner in.,Electronics,Nike,1408,1582,26,img0.jpg,True,True
Century Product,Itself involve usually short child.,Home,Generic,2023,2211,49,img1.jpg,False,True
Argue Product,Enough box story question change.,Home,Adidas,1496,1631,13,img2.jpg,False,True
Store Product,Politics determine decade message simple.,Electronics,Nike,1221,1410,27,img3.jpg,True,True
Traditional Product,Dark see today why area fly bank fill.,Sports,Adidas,2822,2921,10,img4.jpg,False,False
Loss Product,First the chance vote whether around.,Sports,Apple,358,538,9,img5.jpg,True,False
Protect Product,Herself price glass able.,Home,Adidas,1993,2178,29,img6.jpg,False,False
Wonder Product,Attention nature available just win.,Home,Samsung,2904,3013,3,img7.jpg,True,True
Popular Product,Wait top something notice suddenly.,Sports,Samsung,1405,1472,32,img8.jpg,True,False
Training Product,History program store financial agree choose.,Clothing,Apple,2892,3039,43,img9.jpg,True,False
Actually Product,Assume new mention serve expert control lose.,Beauty,Samsung,2995,3137,39,img10.jpg,True,False
Indeed Product,One Mrs help wish girl.,Sports,Adidas,1198,1366,16,img11.jpg,True,True
Girl Product,Perform remain strategy organization.,Home,Apple,1755,1819,3,img12.jpg,False,True
Stuff Product,Suffer believe fast some.,Sports,Samsung,1957,2094,42,img13.jpg,True,False
Agree Product,Early picture source wall.,Sports,Adidas,987,1153,28,img14.jpg,False,True
Decide Product,Unit military season how point set.,Beauty,Nike,1027,1103,17,img15.jpg,True,False
Thousand Product,Organization serve behind card prevent agent whom son.,Clothing,Samsung,456,572,48,img16.jpg,False,False
Decision Product,Democratic middle and recently.,Beauty,Samsung,2308,2397,44,img17.jpg,False,True
Recent Product,Investment ahead rise today military.,Electronics,Adidas,1060,1236,2,img18.jpg,False,False
Tell Product,Throughout director where send.,Electronics,Samsung,435,627,21,img19.jpg,True,True
Before Product,Could information anything capital view subject through.,Beauty,Adidas,1663,1774,13,img20.jpg,True,False
Attack Product,Local mouth time sister ability.,Beauty,Samsung,601,642,22,img21.jpg,True,True
Black Product,Despite business movement network.,Beauty,Adidas,193,305,49,img22.jpg,True,False
Need Product,Executive firm investment research group wish sea.,Clothing,Apple,853,942,22,img23.jpg,False,True
Down Product,Class relationship middle occur seem capital camera.,Electronics,Adidas,1216,1274,34,img24.jpg,True,True
Born Product,Use value race indeed.,Beauty,Nike,2781,2895,30,img25.jpg,False,True
Member Product,Rate business know cause.,Home,Apple,212,372,21,img26.jpg,False,False
Prevent Product,Floor still appear him finally.,Clothing,Adidas,2531,2637,33,img27.jpg,False,False
Evening Product,Time often road able head perform.,Clothing,Adidas,2527,2571,28,img28.jpg,False,False
Enter Product,True democratic serious bring test senior.,Beauty,Adidas,1886,1954,39,img29.jpg,False,True
Tonight Product,Long many table want true.,Sports,Samsung,1283,1468,5,img30.jpg,False,True
Spend Product,Already scene time rate.,Electronics,Nike,1951,2137,23,img31.jpg,False,False
Throw Product,Evening bag TV speak PM.,Home,Apple,2606,2786,43,img32.jpg,True,False
Several Product,Evidence clearly newspaper education night likely.,Sports,Nike,2787,2962,1,img33.jpg,False,True
Thing Product,Writer future agency fly single.,Beauty,Generic,1485,1677,19,img34.jpg,True,False
Exactly Product,Task me do word care senior day.,Sports,Generic,2811,2951,32,img35.jpg,True,False
Work Product,Health natural above you consumer apply risk.,Beauty,Samsung,654,844,45,img36.jpg,False,False
Increase Product,Every sound painting as amount.,Home,Generic,101,142,3,img37.jpg,False,True
Turn Product,Area tough table skill choose drug surface.,Electronics,Adidas,1335,1462,45,img38.jpg,False,True
Century Product,Man change serve most thousand approach play.,Home,Samsung,1405,1577,43,img39.jpg,True,False
Education Product,Plant determine last put idea quickly.,Home,Nike,2329,2420,46,img40.jpg,True,False
Response Product,Voice field place church never wife again.,Clothing,Nike,1387,1503,46,img41.jpg,True,False
Culture Product,This whatever he public.,Electronics,Adidas,174,214,0,img42.jpg,True,False
Minute Product,Raise decide all a toward.,Home,Generic,2745,2851,11,img43.jpg,False,False
Trade Product,Director minute be.,Home,Apple,2048,2189,49,img44.jpg,False,False
Garden Product,See fight it film represent single.,Beauty,Apple,2905,3050,43,img45.jpg,False,False
Approach Product,Strategy lawyer create family speech.,Sports,Generic,814,1008,22,img46.jpg,False,True
Recent Product,Player beat so.,Sports,Apple,1617,1771,42,img47.jpg,False,False
Team Product,I hot rise that.,Clothing,Nike,762,875,31,img48.jpg,True,True
System Product,Food whole line term.,Sports,Adidas,2013,2112,48,img49.jpg,False,False
Sense Product,Ago system message real water my.,Beauty,Nike,1454,1467,32,img50.jpg,False,True
One Product,Appear born investment rate majority where.,Beauty,Generic,1063,1170,49,img51.jpg,False,True
Subject Product,Already southern film.,Clothing,Nike,2998,3121,8,img52.jpg,False,True
Election Product,Represent chair member security.,Clothing,Apple,2815,2883,14,img53.jpg,False,False
Difference Product,Capital lose suffer central certainly head whatever.,Beauty,Adidas,126,183,23,img54.jpg,True,True
Material Product,Next total wind force ok foreign.,Sports,Samsung,2440,2459,34,img55.jpg,False,False
Exactly Product,Remain or check candidate notice.,Clothing,Adidas,2418,2428,11,img56.jpg,True,True
Let Product,Sort official perform suddenly month special lot.,Home,Adidas,742,800,28,img57.jpg,False,False
Participant Product,Relationship property bring site follow professional Republican.,Electronics,Adidas,1741,1894,43,img58.jpg,False,True
More Product,Image floor from stock police which.,Home,Samsung,1610,1627,8,img59.jpg,False,True
Church Product,Less experience purpose those generation evidence.,Sports,Nike,2278,2398,44,img60.jpg,True,True
Statement Product,Issue law tell already relate stock dark.,Clothing,Samsung,1955,1991,49,img61.jpg,False,True
Outside Product,Protect I bar start individual her box.,Home,Nike,2214,2291,50,img62.jpg,True,True
Who Product,Opportunity report grow firm method.,Beauty,Apple,586,778,44,img63.jpg,True,True
Hundred Product,Learn final campaign accept center sister play.,Sports,Nike,2017,2062,21,img64.jpg,False,True
Dinner Product,Continue you positive.,Electronics,Nike,632,673,46,img65.jpg,False,False
East Product,Green bit program official else service card.,Sports,Apple,2683,2749,49,img66.jpg,True,True
Open Product,Catch through Mr better.,Clothing,Nike,1667,1772,27,img67.jpg,True,False
Offer Product,Road ten financial almost such.,Home,Samsung,2576,2705,16,img68.jpg,True,False
Ball Product,Arm scientist suffer bag.,Beauty,Adidas,2241,2428,4,img69.jpg,False,False
Drop Product,Community cup really young true everyone treat.,Beauty,Samsung,2461,2626,29,img70.jpg,False,False
Huge Product,Smile movement beautiful.,Beauty,Apple,363,536,33,img71.jpg,False,True
Fund Product,High generation yourself show behavior.,Beauty,Apple,2827,2871,30,img72.jpg,False,True
Bed Product,Question provide smile also.,Sports,Generic,1015,1084,34,img73.jpg,True,False
Partner Product,Sort available happy both model actually.,Home,Adidas,1645,1818,22,img74.jpg,False,False
Cup Product,Democratic election accept power.,Clothing,Samsung,2110,2177,6,img75.jpg,False,True
Party Product,Hold season economic administration team look politics.,Beauty,Generic,1037,1157,33,img76.jpg,True,True
Avoid Product,High something network skin recently real.,Home,Samsung,380,438,6,img77.jpg,False,True
Computer Product,Section sister when candidate area get.,Sports,Apple,2120,2241,27,img78.jpg,True,False
It Product,Your relationship join result across write technology perhaps.,Sports,Samsung,2534,2567,5,img79.jpg,True,False
Appear Product,Purpose important staff people different detail too.,Sports,Adidas,1185,1374,45,img80.jpg,False,False
Soldier Product,From affect seat pressure program produce.,Electronics,Adidas,569,665,14,img81.jpg,False,False
Interest Product,Authority data around piece maybe table.,Electronics,Samsung,2530,2726,14,img82.jpg,True,True
Lead Product,Theory east agency policy road.,Beauty,Generic,1976,2001,8,img83.jpg,False,False
Worry Product,Hit see probably another wear.,Electronics,Generic,1466,1618,44,img84.jpg,True,True
None Product,Mouth factor group wind ahead success rate.,Beauty,Nike,1218,1330,12,img85.jpg,False,False
Use Product,Chair represent money what imagine site bag doctor.,Home,Adidas,750,941,36,img86.jpg,True,False
Perform Product,Own power with.,Electronics,Generic,2433,2519,40,img87.jpg,True,False
Build Product,Goal responsibility blue candidate shake pick understand.,Clothing,Adidas,309,499,39,img88.jpg,True,False
Conference Product,Choose order order blood statement spend site.,Electronics,Generic,2140,2190,43,img89.jpg,False,False
Bed Product,Half bar phone tell.,Clothing,Nike,858,908,7,img90.jpg,True,True
Fish Product,Well experience fire.,Home,Samsung,1097,1257,15,img91.jpg,True,True
Realize Product,Arm race almost.,Electronics,Apple,1247,1423,24,img92.jpg,False,True
Same Product,Type history beautiful idea.,Beauty,Nike,1188,1304,10,img93.jpg,True,True
Save Product,Once thought good already.,Home,Generic,1873,1915,7,img94.jpg,False,True
Item Product,Conference surface fly particularly product.,Sports,Samsung,1107,1294,24,img95.jpg,True,True
Style Product,Huge professor painting south happen with.,Home,Nike,2636,2810,45,img96.jpg,True,False
Weight Product,Challenge too Democrat natural learn city.,Home,Samsung,319,342,48,img97.jpg,False,True
Stage Product,Bad cultural through simply.,Clothing,Adidas,2174,2270,2,img98.jpg,True,False
Benefit Product,Focus life girl dinner bar every.,Sports,Adidas,1581,1708,40,img99.jpg,False,False
Very Product,Miss remain author necessary avoid.,Sports,Adidas,2834,2981,9,img100.jpg,False,True
Difficult Product,Entire hour life same.,Home,Adidas,933,1033,43,img101.jpg,True,False
Good Product,Bring source lot garden talk despite.,Sports,Apple,2191,2221,43,img102.jpg,False,False
Necessary Product,Stand born necessary sport finish stop.,Electronics,Samsung,924,1009,21,img103.jpg,True,False
Election Product,Doctor boy bit material purpose fly field within.,Sports,Generic,2334,2520,24,img104.jpg,True,True
Above Product,Onto myself let end they.,Clothing,Generic,2776,2840,30,img105.jpg,True,False
Still Product,Building approach discussion.,Clothing,Samsung,1974,2121,35,img106.jpg,True,False
Win Product,Large suggest on beautiful hot.,Home,Nike,1717,1770,28,img107.jpg,False,True
Garden Product,Detail old focus phone course.,Home,Samsung,2414,2525,10,img108.jpg,False,False
Baby Product,Before clear often too show move.,Electronics,Apple,2653,2744,16,img109.jpg,True,True
Pretty Product,Entire green public more sometimes almost.,Clothing,Apple,2041,2197,28,img110.jpg,False,True
Standard Product,Near career environment those.,Clothing,Apple,229,295,29,img111.jpg,True,False
Theory Product,Include above low avoid control.,Beauty,Samsung,1972,2024,45,img112.jpg,False,False
Point Product,Bit even PM Mr story.,Sports,Adidas,2432,2597,16,img113.jpg,True,True
Blood Product,You check other throughout where always decision.,Home,Apple,2694,2732,21,img114.jpg,True,True
Line Product,Such give fight although brother collection east list.,Sports,Samsung,688,812,5,img115.jpg,True,False
Him Product,Without three point method.,Beauty,Samsung,2974,3100,29,img116.jpg,False,True
Traditional Product,Expect hard ahead.,Beauty,Samsung,2172,2294,43,img117.jpg,True,True
Nothing Product,Less difficult here money.,Home,Nike,1506,1580,40,img118.jpg,False,True
Detail Product,Glass present marriage hair beyond design.,Beauty,Adidas,2710,2867,3,img119.jpg,False,True
Window Product,Ability one media newspaper.,Beauty,Apple,522,574,25,img120.jpg,False,True
End Product,Also shoulder value population million computer.,Home,Samsung,818,936,18,img121.jpg,False,True
Apply Product,Whom piece region skill social.,Electronics,Samsung,1466,1643,5,img122.jpg,True,False
Bring Product,White discover before from face region score.,Beauty,Nike,942,961,17,img123.jpg,False,False
Analysis Product,Film southern may above prevent.,Sports,Nike,1093,1208,14,img124.jpg,True,False
Reveal Product,Risk either become as move.,Electronics,Apple,2046,2194,50,img125.jpg,False,True
Fly Product,Brother list sit effort third language why.,Clothing,Generic,1417,1532,31,img126.jpg,False,False
When Product,Indicate inside attack maybe four skill.,Home,Adidas,1704,1745,44,img127.jpg,True,False
Why Product,Girl office so each.,Clothing,Apple,390,523,24,img128.jpg,True,True
Live Product,Pretty policy future wrong letter ever research building.,Sports,Nike,1511,1598,26,img129.jpg,True,False
Pm Product,Interesting read lead new field evening plan.,Home,Nike,169,211,2,img130.jpg,True,True
Their Product,Enter difficult choose sometimes.,Sports,Adidas,2856,2930,39,img131.jpg,False,True
Option Product,Move radio down possible skin.,Electronics,Adidas,1098,1273,10,img132.jpg,True,True
Third Product,Lot marriage inside others occur.,Sports,Adidas,1022,1080,42,img133.jpg,False,True
Relationship Product,Physical enter per major.,Clothing,Samsung,1453,1585,44,img134.jpg,True,True
One Product,Stock take painting.,Beauty,Apple,980,1094,16,img135.jpg,False,False
Now Product,Truth read drive thousand trip board.,Sports,Generic,74,126,18,img136.jpg,False,False
Few Product,Station air campaign fund argue start fish.,Home,Nike,2149,2289,33,img137.jpg,False,False
Daughter Product,Left light decide soon rate whom effort.,Clothing,Adidas,2067,2157,39,img138.jpg,False,True
Watch Product,Interesting what whole me should.,Sports,Generic,1946,2052,4,img139.jpg,True,False
So Product,Cell policy training home responsibility.,Clothing,Generic,93,137,18,img140.jpg,False,False
Training Product,Way process blue the decade.,Clothing,Adidas,2143,2200,34,img141.jpg,True,True
Tv Product,At social listen significant.,Beauty,Samsung,2719,2790,17,img142.jpg,True,False
Fire Product,Knowledge bring former ago benefit.,Electronics,Samsung,1882,2057,3,img143.jpg,False,False
Address Product,Resource talk knowledge fast else box.,Sports,Apple,183,247,2,img144.jpg,False,False
Like Product,Each west them.,Beauty,Apple,888,1088,31,img145.jpg,False,True
Physical Product,Billion place tonight theory mother.,Clothing,Apple,2194,2288,44,img146.jpg,False,False
Religious Product,Against option use hope ball special role.,Sports,Apple,2171,2370,6,img147.jpg,True,True
Painting Product,Per music Mr miss sound law.,Electronics,Apple,2533,2586,17,img148.jpg,True,False
Represent Product,Street run chair tax take reality type live.,Beauty,Samsung,2550,2648,6,img149.jpg,False,False
Probably Product,Staff decision in.,Home,Apple,1538,1570,26,img150.jpg,True,False
Movement Product,Offer TV wrong nothing task join within thing.,Beauty,Samsung,1690,1712,23,img151.jpg,True,False
Them Product,Cultural team win member.,Electronics,Adidas,1199,1346,43,img152.jpg,False,False
Condition Product,Effort off without man population.,Sports,Generic,2582,2684,34,img153.jpg,True,False
Throughout Product,Offer better lot air home.,Sports,Adidas,516,634,34,img154.jpg,True,False
Without Product,Some than tend social ground reflect.,Electronics,Nike,411,600,49,img155.jpg,False,False
Street Product,While trial try.,Sports,Apple,2964,3158,13,img156.jpg,False,True
Down Product,Majority sometimes computer high.,Clothing,Nike,1631,1798,41,img157.jpg,False,True
Certain Product,Son according make speak election theory.,Home,Adidas,2945,3000,15,img158.jpg,True,False
Picture Product,Whole north board when cover follow executive.,Beauty,Nike,403,522,45,img159.jpg,True,False
Design Product,Activity water like charge leg.,Beauty,Adidas,2862,3009,40,img160.jpg,False,False
Spend Product,Despite behind morning affect during.,Clothing,Apple,1512,1522,39,img161.jpg,True,False
Act Product,Detail eight standard street city point project.,Home,Generic,130,148,22,img162.jpg,True,True
While Product,Act class matter.,Clothing,Adidas,2649,2758,32,img163.jpg,False,False
Structure Product,Page whom building white who down security.,Beauty,Nike,1677,1829,37,img164.jpg,True,False
Attorney Product,Factor risk part compare receive.,Home,Apple,348,416,50,img165.jpg,True,False
Year Product,Door significant possible trial military organization issue.,Electronics,Nike,1582,1713,42,img166.jpg,True,False
Upon Product,Development senior foot radio keep life.,Sports,Samsung,290,441,4,img167.jpg,True,False
Best Product,Center get among PM.,Beauty,Apple,860,962,34,img168.jpg,False,True
World Product,Exactly another loss sing.,Beauty,Adidas,1769,1889,23,img169.jpg,True,False
Least Product,Church feel behavior nearly.,Clothing,Generic,500,510,0,img170.jpg,False,False
Provide Product,Walk suddenly very position.,Clothing,Apple,418,452,25,img171.jpg,True,False
Similar Product,Room forward sport.,Clothing,Samsung,1790,1928,16,img172.jpg,True,True
We Product,Daughter whole soldier none class scientist.,Home,Apple,608,763,27,img173.jpg,True,True
Green Product,Address green team not religious simply.,Electronics,Adidas,263,355,36,img174.jpg,False,False
Raise Product,Order drop all forget.,Clothing,Samsung,971,1088,34,img175.jpg,False,True
Movie Product,Early behavior adult thousand form play include.,Electronics,Generic,2255,2395,29,img176.jpg,True,True
Strong Product,Feel effect effect card authority glass.,Beauty,Generic,2059,2231,38,img177.jpg,True,True
Tv Product,Add gas thousand risk.,Sports,Apple,808,950,44,img178.jpg,False,False
Run Product,Ago impact trouble happy fall.,Sports,Samsung,1452,1598,41,img179.jpg,True,False
Wind Product,Rest relate picture speech quickly his expert.,Beauty,Samsung,2406,2499,9,img180.jpg,False,True
There Product,Series on figure already.,Electronics,Nike,2252,2373,43,img181.jpg,False,False
Research Product,Thus kind should sport practice firm among.,Clothing,Nike,2644,2678,36,img182.jpg,False,True
High Product,Cut happen kind wind college.,Home,Samsung,428,449,13,img183.jpg,True,True
Body Product,Question either recognize relationship.,Electronics,Generic,1650,1714,45,img184.jpg,True,True
Piece Product,Sport throw not let understand so.,Electronics,Adidas,472,632,4,img185.jpg,False,False
Buy Product,Rate sport eye according scientist.,Clothing,Nike,2457,2565,6,img186.jpg,True,True
Dog Product,Prevent prevent create look.,Beauty,Adidas,1676,1865,33,img187.jpg,True,True
Tv Product,Necessary company reality century whether culture.,Clothing,Nike,430,529,41,img188.jpg,False,True
Add Product,Time like various worker still after level.,Beauty,Generic,473,577,21,img189.jpg,False,False
Card Product,Firm program enjoy policy.,Beauty,Adidas,1780,1842,34,img190.jpg,True,True
Control Product,Special computer magazine likely Republican movie to.,Home,Samsung,2339,2412,27,img191.jpg,False,True
Specific Product,Who which by reach fire next suggest.,Clothing,Apple,2324,2489,33,img192.jpg,False,True
Thing Product,Skin western issue career high church camera.,Electronics,Apple,1430,1546,40,img193.jpg,True,False
Idea Product,Process right care party story tough customer control.,Electronics,Apple,949,1119,33,img194.jpg,True,False
Rule Product,Resource several think describe fish first Congress.,Electronics,Apple,108,178,29,img195.jpg,True,False
Ball Product,Investment present score now.,Beauty,Nike,223,320,6,img196.jpg,True,True
Natural Product,Land each show summer leave write teacher.,Sports,Nike,1795,1820,26,img197.jpg,False,True
History Product,Opportunity do film central between recognize force such.,Clothing,Nike,697,880,30,img198.jpg,False,False
Possible Product,Course quite something south guy personal news.,Beauty,Nike,1333,1453,31,img199.jpg,True,False
Area Product,Among threat course hope stand professional.,Home,Generic,1963,2049,39,img200.jpg,False,False
Somebody Product,Indicate risk need author.,Electronics,Samsung,2364,2486,18,img201.jpg,True,False
Example Product,Eat brother also ago smile business public.,Clothing,Nike,381,442,50,img202.jpg,False,True
Inside Product,Effort edge perhaps meeting action approach.,Home,Generic,66,252,24,img203.jpg,False,False
Its Product,Back star often company large.,Beauty,Apple,2640,2778,1,img204.jpg,True,True
Around Product,Without week lead goal.,Electronics,Samsung,351,438,9,img205.jpg,True,True
Assume Product,Go once meet.,Sports,Apple,1445,1625,22,img206.jpg,True,True
Over Product,Property meet just cut serve deep.,Clothing,Generic,869,911,10,img207.jpg,True,True
Hand Product,East technology stock meet.,Electronics,Samsung,2159,2278,5,img208.jpg,True,True
Teach Product,Skill customer matter station.,Clothing,Samsung,486,589,11,img209.jpg,True,True
Record Product,Couple before chance us.,Sports,Generic,2061,2223,14,img210.jpg,False,True
Rich Product,Challenge resource trip care person fear.,Sports,Nike,475,618,17,img211.jpg,False,True
Lot Product,Can meet big amount them money any.,Home,Adidas,1648,1807,7,img212.jpg,False,True
Condition Product,Particularly increase direction matter protect.,Electronics,Nike,128,312,38,img213.jpg,False,False
Information Product,Agency age civil too.,Beauty,Apple,1361,1380,4,img214.jpg,True,True
Six Product,Man unit radio environment visit majority subject possible.,Beauty,Nike,1070,1242,25,img215.jpg,True,True
Drive Product,Loss to both would listen.,Sports,Adidas,2340,2522,50,img216.jpg,False,True
She Product,Mention person move line fish note.,Home,Adidas,2434,2512,17,img217.jpg,True,False
Yes Product,Discuss per this want great rock.,Beauty,Samsung,688,869,0,img218.jpg,True,True
Father Product,Movie score indicate whom least citizen.,Clothing,Adidas,1786,1811,19,img219.jpg,False,True
Relationship Product,Be life a service.,Sports,Adidas,2381,2482,48,img220.jpg,False,False
Office Product,Analysis compare become yeah decide attention.,Beauty,Adidas,2709,2722,14,img221.jpg,False,True
Nation Product,Available popular contain pick possible night action.,Beauty,Generic,2677,2737,46,img222.jpg,False,False
Wait Product,Eat business along.,Clothing,Apple,2415,2499,10,img223.jpg,True,False
State Product,Hear help whom dinner imagine administration.,Electronics,Apple,2843,2933,12,img224.jpg,False,True
Happen Product,At goal provide know.,Home,Generic,1621,1721,47,img225.jpg,True,False
Yard Product,She garden expert maybe involve.,Sports,Nike,698,756,46,img226.jpg,True,False
At Product,Pretty team weight suffer listen avoid so.,Clothing,Apple,2434,2593,50,img227.jpg,True,True
Parent Product,Interview quite serious candidate he impact peace production.,Home,Adidas,178,365,38,img228.jpg,False,True
Tv Product,Low husband camera then attack call local.,Electronics,Samsung,78,99,16,img229.jpg,True,False
What Product,Skin tree land leg have.,Sports,Generic,2437,2591,46,img230.jpg,True,True
To Product,Family character stock place act option.,Beauty,Samsung,1470,1519,14,img231.jpg,False,True
Stuff Product,Level laugh successful traditional west.,Home,Nike,2071,2178,2,img232.jpg,True,False
Sometimes Product,Instead sport enjoy religious develop international own trip.,Beauty,Apple,452,562,6,img233.jpg,False,False
Work Product,Though compare lay list future degree skin.,Sports,Apple,2157,2221,8,img234.jpg,True,False
Name Product,Read phone chance within four nor energy nation.,Beauty,Samsung,2872,2944,30,img235.jpg,False,True
Step Product,Board present current institution miss.,Electronics,Apple,2384,2558,31,img236.jpg,True,True
Suggest Product,Herself material kid.,Electronics,Apple,664,861,41,img237.jpg,True,True
Project Product,Address assume ready hour job care.,Beauty,Nike,1532,1552,8,img238.jpg,True,False
Hospital Product,Protect institution wind.,Clothing,Apple,1877,1957,5,img239.jpg,False,True
Never Product,While benefit thousand three.,Beauty,Nike,630,786,19,img240.jpg,True,True
Type Product,Doctor price teach arm impact rule.,Clothing,Adidas,240,260,16,img241.jpg,False,True
Reach Product,Position enter thus.,Home,Apple,835,928,18,img242.jpg,False,True
White Product,Security how example statement tree.,Beauty,Nike,1028,1157,30,img243.jpg,True,False
Together Product,Need develop box price research.,Sports,Adidas,1730,1837,19,img244.jpg,False,False
Myself Product,Event entire notice.,Beauty,Nike,1773,1788,35,img245.jpg,True,False
Industry Product,Purpose move resource society.,Clothing,Adidas,431,602,29,img246.jpg,True,True
Now Product,Material south serious mean necessary production science.,Electronics,Apple,2840,2898,14,img247.jpg,True,False
Sell Product,American bed off.,Beauty,Adidas,576,615,23,img248.jpg,True,False
Possible Product,Let bad rock suggest.,Clothing,Generic,424,502,23,img249.jpg,False,False
Receive Product,Hair here as crime majority.,Electronics,Nike,2117,2220,11,img250.jpg,True,False
Center Product,Best difficult career message.,Beauty,Adidas,839,872,42,img251.jpg,False,False
Heart Product,Across when interview left weight me perhaps.,Home,Apple,1313,1414,10,img252.jpg,True,True
North Product,Us on huge raise.,Electronics,Adidas,2202,2253,15,img253.jpg,False,False
Save Product,Without three let board military.,Sports,Samsung,1835,1927,18,img254.jpg,False,True
Police Product,Community tree find open heart huge.,Electronics,Samsung,1305,1371,11,img255.jpg,False,True
Continue Product,Color international what claim argue.,Sports,Generic,993,1116,12,img256.jpg,True,True
Amount Product,Certainly interest western college brother bad.,Beauty,Apple,2881,2985,31,img257.jpg,True,True
