name,description,category,brand,price,old_price,stock,image,is_available,is_featured
Administration Product,Phone want however when use.,Home,Generic,501,569,32,img515.jpg,False,True
And Product,Maybe reason step.,Electronics,Adidas,928,1074,2,img516.jpg,False,False
Bad Product,How game town per student move.,Sports,Apple,328,357,12,img517.jpg,True,True
Which Product,Just would dream.,Sports,Nike,1184,1362,20,img518.jpg,False,False
Community Product,Majority vote admit example strong.,Electronics,Apple,300,494,37,img519.jpg,True,False
Thus Product,Visit off before writer soon happen ability.,Sports,Samsung,1018,1176,18,img520.jpg,True,False
Collection Product,Else computer should though there agreement body.,Sports,Generic,1822,1939,3,img521.jpg,True,False
Kind Product,Practice gun religious receive would know full.,Home,Adidas,105,176,39,img522.jpg,True,True
And Product,True season according how him which.,Home,Nike,2563,2625,45,img523.jpg,True,True
Rather Product,Like school range it movie.,Sports,Samsung,2446,2464,19,img524.jpg,False,True
Amount Product,Avoid sit admit case.,Home,Generic,2168,2198,46,img525.jpg,False,True
Pull Product,Major bad throughout ever.,Electronics,Generic,2603,2657,28,img526.jpg,True,True
Maybe Product,Down energy summer tend along activity.,Home,Samsung,1600,1690,8,img527.jpg,True,False
Herself Product,Usually understand concern low determine contain.,Sports,Generic,1901,1974,48,img528.jpg,True,True
Structure Product,Old I heart draw television.,Electronics,Adidas,2729,2849,9,img529.jpg,False,False
Reason Product,Including south ten interest.,Sports,Samsung,1960,2159,22,img530.jpg,True,True
From Product,Those which learn inside.,Home,Samsung,708,762,9,img531.jpg,False,True
Order Product,Room pressure newspaper house.,Electronics,Samsung,967,1033,44,img532.jpg,False,False
Have Product,Very few administration.,Clothing,Apple,2687,2713,44,img533.jpg,True,False
Already Product,Friend past son paper.,Beauty,Adidas,1468,1610,48,img534.jpg,True,True
Almost Product,Do second now any successful speech.,Sports,Adidas,310,332,37,img535.jpg,True,True
Impact Product,Political apply some person ever usually drug hot.,Electronics,Apple,1597,1722,5,img536.jpg,True,False
Against Product,Story often cell born onto.,Sports,Samsung,1024,1058,25,img537.jpg,False,True
Tell Product,Off two seat different statement.,Clothing,Generic,2785,2867,12,img538.jpg,True,True
Professor Product,Wall news defense song citizen although these husband.,Beauty,Apple,846,1010,20,img539.jpg,False,False
Material Product,More fill ago beautiful fear describe animal.,Home,Apple,1388,1455,33,img540.jpg,False,False
Ago Product,Left they window activity.,Home,Adidas,2109,2176,33,img541.jpg,True,True
Other Product,Everything former there.,Beauty,Nike,438,628,7,img542.jpg,False,False
Find Product,Usually partner crime second same.,Sports,Generic,1093,1128,44,img543.jpg,False,True
Bill Product,Father view garden study teach model light.,Clothing,Generic,2073,2083,32,img544.jpg,False,True
Whom Product,Seem life probably positive although.,Beauty,Apple,538,692,48,img545.jpg,False,False
Provide Product,Near entire place number ago against run.,Clothing,Apple,2828,3005,35,img546.jpg,False,True
Full Product,Local should fire open.,Home,Nike,2092,2235,12,img547.jpg,True,True
Art Product,Under debate support.,Clothing,Nike,2427,2533,50,img548.jpg,False,False
Never Product,Future table garden a.,Electronics,Apple,1927,2036,32,img549.jpg,True,False
Design Product,Project style low necessary remember blue interest.,Clothing,Nike,2863,3062,20,img550.jpg,False,False
Might Product,Range opportunity ball policy perhaps politics campaign risk.,Home,Apple,1872,2009,11,img551.jpg,True,True
Carry Product,Learn why sign eat anything.,Beauty,Nike,2149,2336,30,img552.jpg,True,False
Investment Product,Thought offer management various feeling determine word.,Sports,Apple,172,351,35,img553.jpg,True,True
Truth Product,Themselves great attention crime town thousand agree.,Electronics,Samsung,1501,1664,4,img554.jpg,True,False
First Product,Since able glass court name reach speech.,Electronics,Apple,149,209,39,img555.jpg,False,False
Of Product,Sing such whole leave.,Electronics,Apple,2195,2247,34,img556.jpg,False,True
Structure Product,Like kind far professor through television story road.,Electronics,Generic,867,1006,40,img557.jpg,True,True
Rate Product,Voice thank better south present wear.,Electronics,Adidas,950,966,22,img558.jpg,True,True
Visit Product,Shoulder PM quickly TV onto part statement.,Clothing,Apple,830,991,7,img559.jpg,False,True
Idea Product,Collection cause agree financial.,Electronics,Generic,1685,1757,4,img560.jpg,False,True
Paper Product,Until agree place since note.,Clothing,Samsung,2621,2742,46,img561.jpg,True,False
Would Product,Real Congress ahead.,Home,Nike,2569,2669,2,img562.jpg,False,True
Buy Product,Race generation give difference light.,Sports,Generic,860,1030,44,img563.jpg,False,False
Economy Product,Impact like expert exist lose.,Sports,Samsung,2115,2133,36,img564.jpg,False,True
Message Product,Soon his cut before.,Clothing,Generic,291,379,16,img565.jpg,True,True
Author Product,Quality understand find moment wind member.,Beauty,Apple,175,237,27,img566.jpg,False,False
Method Product,Whose discuss traditional thing focus result.,Beauty,Generic,457,469,15,img567.jpg,True,True
Computer Product,Be we suggest indicate fund relationship save.,Sports,Adidas,2213,2394,24,img568.jpg,True,False
Somebody Product,Nature his film look safe tax.,Electronics,Adidas,2049,2170,50,img569.jpg,False,True
Sign Product,Major sort should man miss writer bag.,Electronics,Apple,1965,2020,18,img570.jpg,False,True
Picture Product,Likely movement put special someone tell.,Electronics,Nike,2740,2830,31,img571.jpg,False,True
Whom Product,Safe usually beautiful space.,Sports,Apple,485,609,14,img572.jpg,True,True
Whole Product,Position act similar wife.,Electronics,Adidas,563,608,10,img573.jpg,True,True
Successful Product,Focus past other happen call discover move.,Home,Samsung,2016,2115,45,img574.jpg,True,False
Skill Product,Agent good mind soon professor should.,Sports,Apple,1629,1754,40,img575.jpg,False,True
Sit Product,Home economy decision check world shake.,Electronics,Samsung,2023,2072,50,img576.jpg,True,True
Within Product,Project wide citizen section nor structure policy PM.,Home,Generic,1866,1998,49,img577.jpg,False,True
Risk Product,Stop over official about laugh.,Home,Nike,1087,1126,2,img578.jpg,False,True
Stand Product,Bill small federal report next power.,Clothing,Nike,971,1079,35,img579.jpg,True,False
Movement Product,Bag remember democratic knowledge.,Clothing,Adidas,1582,1684,17,img580.jpg,False,True
Hard Product,Loss purpose general weight pattern able.,Electronics,Nike,304,458,15,img581.jpg,True,True
Mean Product,Figure process consider.,Sports,Adidas,2977,3009,10,img582.jpg,False,False
Student Product,Bring skill staff voice available television remain.,Sports,Samsung,1916,2109,26,img583.jpg,False,False
President Product,Hotel worker call wall.,Home,Generic,1577,1743,28,img584.jpg,True,True
Who Product,Market statement difference executive fill hope election support.,Beauty,Apple,1616,1766,14,img585.jpg,True,True
Agency Product,Clearly raise job personal pattern phone at.,Clothing,Nike,2750,2945,27,img586.jpg,True,True
Form Product,Return size sell contain statement success.,Electronics,Apple,640,827,42,img587.jpg,False,True
Store Product,Few truth exactly month policy down foot.,Home,Generic,2192,2349,37,img588.jpg,True,False
Direction Product,Guess between themselves every hit authority responsibility man.,Home,Adidas,2731,2814,18,img589.jpg,False,False
Child Product,Market region fast example third player necessary.,Sports,Generic,308,382,36,img590.jpg,False,False
Involve Product,Identify garden board herself force.,Home,Generic,836,863,4,img591.jpg,True,False
Medical Product,Career agent everyone what house.,Sports,Nike,784,949,32,img592.jpg,False,False
Shoulder Product,To all their company page catch man.,Electronics,Nike,213,345,8,img593.jpg,True,False
Follow Product,Pattern detail class blue nice well hair.,Beauty,Apple,718,859,47,img594.jpg,False,False
Assume Product,I today night base degree traditional.,Clothing,Nike,1082,1230,19,img595.jpg,True,True
Executive Product,Your yes debate form high gun.,Beauty,Adidas,729,769,7,img596.jpg,True,True
Red Product,Include article action eight boy wrong significant.,Sports,Generic,1794,1930,42,img597.jpg,False,False
Chance Product,Without government lot church quality partner.,Sports,Apple,100,217,6,img598.jpg,True,False
Stage Product,Mouth positive her home art if may paper.,Sports,Nike,2444,2498,22,img599.jpg,False,False
Whole Product,Second movement scientist election space.,Home,Samsung,1913,2052,19,img600.jpg,True,True
Under Product,During summer arrive together word rather western.,Sports,Generic,794,902,32,img601.jpg,True,True
Focus Product,Couple administration face rule theory teacher enough.,Beauty,Apple,688,864,4,img602.jpg,True,True
Best Product,Simply manage brother factor voice sport expect radio.,Beauty,Generic,941,1053,15,img603.jpg,True,False
Another Product,Feeling what theory quite.,Home,Nike,1449,1649,39,img604.jpg,True,True
Teacher Product,Tax best spring around personal condition.,Home,Generic,2746,2790,41,img605.jpg,True,True
This Product,Culture speak science forward accept again.,Electronics,Adidas,2413,2606,27,img606.jpg,False,True
Single Product,Investment able with down lot huge.,Clothing,Apple,1007,1082,48,img607.jpg,False,True
Section Product,Your radio year service.,Electronics,Generic,2697,2880,1,img608.jpg,True,False
Bill Product,Station stop story find.,Clothing,Adidas,308,346,8,img609.jpg,True,True
Upon Product,Similar body able go most appear.,Clothing,Nike,905,1030,17,img610.jpg,False,True
Pretty Product,Tree include whose side news degree.,Clothing,Adidas,1443,1567,11,img611.jpg,False,True
Once Product,Gas city kitchen affect traditional some.,Clothing,Adidas,130,316,39,img612.jpg,False,True
Else Product,While able despite television several together why.,Electronics,Samsung,1882,1992,1,img613.jpg,False,False
Skill Product,Some reach family way education move.,Home,Generic,89,246,22,img614.jpg,False,False
Purpose Product,Common responsibility language American east blood.,Electronics,Nike,2053,2093,49,img615.jpg,False,False
Yet Product,Enough most eye home project.,Clothing,Nike,1836,1980,16,img616.jpg,True,True
Ball Product,Method senior form popular early.,Clothing,Apple,2419,2604,12,img617.jpg,False,False
Hair Product,Reason drug feel meeting third real book.,Home,Nike,1448,1501,48,img618.jpg,False,True
Small Product,Treat bring business which when.,Home,Adidas,2358,2424,37,img619.jpg,False,True
Special Product,Their crime hard goal learn.,Electronics,Nike,202,325,20,img620.jpg,True,True
Feel Product,Provide practice shoulder chair glass.,Home,Adidas,983,1007,1,img621.jpg,True,True
Girl Product,Sense professor able change have true.,Sports,Generic,880,965,29,img622.jpg,False,False
Us Product,Floor lawyer rock hand fight.,Electronics,Apple,2737,2847,2,img623.jpg,True,False
Total Product,Detail bring raise hotel.,Electronics,Apple,1198,1349,14,img624.jpg,True,False
Management Product,Loss work over like.,Electronics,Adidas,2581,2726,1,img625.jpg,False,True
Address Product,Coach pull where could knowledge network world go.,Electronics,Samsung,986,1061,38,img626.jpg,True,True
Return Product,Level new issue radio address citizen protect.,Clothing,Apple,480,508,18,img627.jpg,False,False
Since Product,Physical knowledge clear allow.,Sports,Generic,468,653,10,img628.jpg,False,True
Close Product,May issue leader step.,Electronics,Apple,69,181,6,img629.jpg,True,True
Performance Product,Get explain agree amount government gun.,Sports,Adidas,252,378,20,img630.jpg,False,True
Standard Product,Rise job everybody case.,Clothing,Generic,2855,3025,21,img631.jpg,True,False
Direction Product,Use campaign material may security anything.,Sports,Nike,2199,2352,24,img632.jpg,False,True
Able Product,Most inside he adult.,Sports,Nike,2379,2444,30,img633.jpg,True,True
Find Product,Democrat hour father leave during.,Electronics,Generic,966,993,36,img634.jpg,True,True
Movie Product,Also hold democratic away action return.,Home,Apple,2965,3079,4,img635.jpg,False,True
Interview Product,Produce food political raise move occur.,Electronics,Samsung,158,173,16,img636.jpg,False,False
Shake Product,Detail over instead agreement keep door.,Home,Adidas,1174,1362,23,img637.jpg,False,True
Fear Product,Political difficult change.,Beauty,Adidas,1524,1603,13,img638.jpg,True,True
Approach Product,If think traditional science.,Home,Apple,1615,1788,15,img639.jpg,True,False
Show Product,Follow value place ok manager support official.,Home,Apple,1227,1335,19,img640.jpg,True,True
Away Product,Skill worry rock along difficult guess truth third.,Sports,Adidas,607,762,15,img641.jpg,True,True
Too Product,Husband food you none case provide authority.,Home,Adidas,1180,1304,6,img642.jpg,False,True
Represent Product,Summer pull age manager leader they often her.,Clothing,Generic,2488,2624,17,img643.jpg,False,False
Cold Product,Way although black strong member health.,Beauty,Nike,1610,1770,14,img644.jpg,True,False
Light Product,Clearly without care beautiful medical.,Clothing,Adidas,1852,1978,11,img645.jpg,True,False
World Product,Kid necessary know work reality purpose history.,Beauty,Adidas,2565,2737,43,img646.jpg,False,True
On Product,Message security seek yes organization world fire.,Clothing,Adidas,1637,1810,35,img647.jpg,True,False
Success Product,Media consumer real door culture win.,Electronics,Generic,2090,2258,31,img648.jpg,True,False
Require Product,Detail group contain this.,Beauty,Adidas,314,497,40,img649.jpg,False,True
Age Product,During whatever run account exist what individual.,Beauty,Nike,1154,1331,23,img650.jpg,True,True
Teach Product,Measure industry government policy test their.,Home,Nike,2001,2129,34,img651.jpg,False,True
Rest Product,Check stuff respond make.,Home,Apple,2609,2804,1,img652.jpg,False,False
Off Product,Later decide enjoy it scene boy.,Clothing,Samsung,1184,1279,44,img653.jpg,False,False
Ahead Product,War structure give lose.,Home,Generic,2184,2252,25,img654.jpg,False,True
Model Product,Contain worker election understand change.,Electronics,Generic,1107,1236,32,img655.jpg,True,False
From Product,Tough think build show special suffer.,Beauty,Generic,2826,2914,29,img656.jpg,True,True
Man Product,Adult he head they central.,Clothing,Apple,2448,2502,29,img657.jpg,False,True
Add Product,Evening newspaper or audience into season.,Clothing,Samsung,1499,1534,46,img658.jpg,False,True
Pay Product,New them with machine know hour day.,Clothing,Samsung,2078,2179,1,img659.jpg,False,False
End Product,Point organization appear fly man sure begin per.,Clothing,Generic,111,167,8,img660.jpg,False,False
Finally Product,When image hope attention contain side force room.,Home,Adidas,107,270,30,img661.jpg,True,True
Challenge Product,Evidence occur site water.,Clothing,Apple,282,468,13,img662.jpg,True,True
Article Product,Day million language line join.,Electronics,Samsung,2202,2239,3,img663.jpg,False,True
Structure Product,Wall fish defense often fight research.,Beauty,Apple,1007,1107,26,img664.jpg,True,True
Finally Product,Rather we these although whom data for.,Beauty,Samsung,879,930,47,img665.jpg,False,False
Determine Product,Security worry admit region.,Electronics,Adidas,2434,2516,39,img666.jpg,False,False
Coach Product,Family ask benefit chance on last go.,Electronics,Nike,2308,2371,22,img667.jpg,False,False
Product Product,Television stock everything military.,Beauty,Generic,2551,2638,7,img668.jpg,True,True
Enter Product,Director manager other.,Home,Adidas,2706,2862,36,img669.jpg,False,False
Vote Product,Hope you attack eye them hope establish.,Sports,Samsung,937,1081,47,img670.jpg,True,True
Enjoy Product,Behavior modern teach mission report.,Clothing,Apple,1143,1200,47,img671.jpg,True,False
Media Product,Paper resource hour citizen.,Beauty,Samsung,1014,1062,22,img672.jpg,True,False
Various Product,Sit drive feeling pull size risk another.,Electronics,Nike,2000,2102,41,img673.jpg,False,False
Born Product,Throw conference perhaps ok democratic look.,Sports,Generic,2655,2698,19,img674.jpg,True,True
Defense Product,Capital business add oil.,Clothing,Generic,54,106,35,img675.jpg,True,False
Owner Product,Few find perform seem.,Sports,Nike,865,1061,44,img676.jpg,True,False
Half Product,Tonight itself eye away series.,Clothing,Adidas,2130,2327,20,img677.jpg,True,False
I Product,Student care evidence participant defense charge deal.,Beauty,Generic,361,527,43,img678.jpg,False,False
And Product,Cut free week evidence mission certain history.,Clothing,Adidas,494,561,8,img679.jpg,False,False
Everything Product,Force many mother interesting.,Beauty,Generic,309,385,27,img680.jpg,True,False
Onto Product,Such they through garden five fire.,Clothing,Apple,946,969,6,img681.jpg,False,False
Who Product,Area building fear however could research.,Electronics,Generic,1078,1182,1,img682.jpg,True,True
Up Product,Fund check fire course.,Clothing,Adidas,1648,1670,48,img683.jpg,True,False
Management Product,Send traditional five give.,Sports,Nike,1869,2001,37,img684.jpg,False,False
Wrong Product,Water turn rule rich special former.,Beauty,Nike,1018,1112,0,img685.jpg,False,False
Word Product,View feeling detail analysis late customer.,Beauty,Apple,1943,2014,30,img686.jpg,True,True
Sea Product,Dog everyone realize generation part recognize detail.,Electronics,Nike,716,764,37,img687.jpg,False,False
Consumer Product,Mouth less director nature final cultural establish.,Electronics,Generic,2313,2448,7,img688.jpg,False,False
Star Product,Protect increase easy already after lose add strategy.,Electronics,Generic,655,796,14,img689.jpg,False,True
Different Product,Word story wide simply make personal.,Electronics,Apple,1468,1573,20,img690.jpg,False,False
Pattern Product,Every news debate often loss car.,Sports,Nike,898,936,21,img691.jpg,False,False
Season Product,Act respond perhaps month series middle.,Home,Apple,1853,1990,12,img692.jpg,False,False
Law Product,Seek sure important crime significant thank record kitchen.,Electronics,Apple,2759,2863,4,img693.jpg,True,False
True Product,Perform which sure address instead.,Home,Apple,1727,1822,22,img694.jpg,False,False
Necessary Product,Others attack behavior talk.,Clothing,Generic,985,1163,31,img695.jpg,True,False
Six Product,Pass set water grow.,Home,Apple,1358,1457,17,img696.jpg,False,False
Another Product,Training short food field.,Electronics,Adidas,2657,2801,4,img697.jpg,True,False
System Product,Decide degree difficult big owner significant.,Electronics,Nike,1623,1768,4,img698.jpg,False,False
Visit Product,Red recognize ask box.,Home,Apple,2006,2131,23,img699.jpg,False,False
Fast Product,Knowledge two difference.,Sports,Generic,188,349,34,img700.jpg,False,True
Heart Product,Affect himself identify book important.,Clothing,Apple,2372,2502,18,img701.jpg,True,True
Police Product,Minute growth past scientist lot lead.,Home,Nike,1828,2005,5,img702.jpg,True,True
Home Product,Long million small inside board.,Clothing,Adidas,188,331,43,img703.jpg,True,True
Each Product,Exist win front industry.,Clothing,Generic,295,477,23,img704.jpg,True,True
Response Product,Yet support both.,Clothing,Apple,1652,1789,28,img705.jpg,True,False
Practice Product,Position green area defense control down.,Sports,Apple,225,405,26,img706.jpg,False,True
Shoulder Product,Mouth summer travel my mission.,Sports,Nike,1816,1915,17,img707.jpg,False,True
Fly Product,Election world common.,Sports,Generic,2762,2833,12,img708.jpg,True,False
Can Product,Action miss church throughout character.,Electronics,Apple,1831,1885,39,img709.jpg,True,True
Institution Product,Miss table church life already education.,Electronics,Apple,332,522,5,img710.jpg,True,True
Town Product,Great light customer peace return contain.,Clothing,Apple,2557,2722,41,img711.jpg,False,False
Total Product,Main open again require about along country.,Beauty,Samsung,1986,2020,33,img712.jpg,False,True
Pass Product,Decide carry popular attorney cost.,Home,Apple,2473,2554,21,img713.jpg,False,False
Now Product,Company father sort we unit keep.,Electronics,Nike,1658,1821,43,img714.jpg,False,True
Short Product,Worker glass around affect than power least.,Beauty,Adidas,793,831,27,img715.jpg,False,False
Production Product,Win really suddenly receive in chance if.,Sports,Generic,2119,2130,26,img716.jpg,False,False
Again Product,Model those positive.,Clothing,Apple,1842,1889,13,img717.jpg,False,True
International Product,Hard party recently four large full.,Sports,Generic,2951,3031,39,img718.jpg,False,True
Develop Product,Design author think model.,Beauty,Generic,144,246,12,img719.jpg,False,True
Cup Product,That report training development.,Sports,Adidas,1146,1299,11,img720.jpg,True,True
Toward Product,Another fear military role describe.,Home,Samsung,2195,2345,42,img721.jpg,True,True
Fact Product,Throw together everybody water check and manage Democrat.,Clothing,Generic,779,865,26,img722.jpg,False,True
Across Product,Law help policy pick reach cold black.,Sports,Generic,2379,2476,25,img723.jpg,False,True
A Product,Democrat media crime foreign they.,Electronics,Nike,2830,3016,3,img724.jpg,True,False
Sure Product,No she brother agree.,Electronics,Generic,2137,2209,26,img725.jpg,True,False
Measure Product,Those agent weight detail name great team large.,Home,Samsung,2905,2978,49,img726.jpg,True,True
Enough Product,That court example start fall.,Sports,Samsung,2046,2181,12,img727.jpg,True,True
Heavy Product,Industry many lot week partner.,Home,Nike,1663,1794,27,img728.jpg,True,True
Know Product,Test send open.,Sports,Generic,2427,2472,0,img729.jpg,True,True
Find Product,Again learn cultural continue spring.,Electronics,Apple,2399,2554,1,img730.jpg,True,True
Democratic Product,Sometimes bar hand similar recently buy allow.,Clothing,Generic,1528,1539,12,img731.jpg,True,False
Personal Product,Similar near social nice population.,Home,Nike,2908,3038,38,img732.jpg,False,False
Main Product,Discover benefit nor kid.,Sports,Generic,1117,1169,10,img733.jpg,False,True
Develop Product,Political listen claim cup.,Sports,Generic,364,390,4,img734.jpg,False,False
Race Product,Only sometimes could billion protect his far.,Home,Apple,2571,2741,2,img735.jpg,False,False
Everything Product,Understand yes condition often.,Clothing,Samsung,2691,2758,39,img736.jpg,True,True
Boy Product,Attack bill same car agree adult.,Beauty,Samsung,1863,2016,19,img737.jpg,False,False
Push Product,Month big indicate ever admit level house citizen.,Electronics,Generic,1523,1554,50,img738.jpg,True,True
Nice Product,Crime good foreign ready but hard team.,Clothing,Generic,2968,3077,42,img739.jpg,False,False
Time Product,Of major someone change kitchen wife perhaps.,Sports,Generic,1285,1351,4,img740.jpg,True,False
Success Product,Before natural score daughter one subject last.,Home,Generic,825,901,6,img741.jpg,True,False
Especially Product,Whose dream former majority.,Sports,Adidas,426,501,50,img742.jpg,True,True
Bed Product,Senior Mrs family travel.,Electronics,Samsung,2368,2445,13,img743.jpg,True,True
Quickly Product,Alone rather until like foreign finally true.,Beauty,Apple,2254,2393,37,img744.jpg,True,False
Cultural Product,Teach dinner vote fight that itself teach.,Clothing,Samsung,1422,1472,5,img745.jpg,True,True
Your Product,Enough reveal single.,Clothing,Apple,1879,2027,23,img746.jpg,False,True
Rate Product,Throughout remember role figure deep see that interview.,Electronics,Samsung,2961,3143,16,img747.jpg,False,False
Paper Product,Mother simple anything sure.,Sports,Generic,1332,1463,9,img748.jpg,False,False
Scientist Product,Have teach nothing work short chair.,Home,Apple,2847,2896,4,img749.jpg,True,True
Effect Product,Far mother eat exactly southern all against.,Electronics,Nike,1548,1655,35,img750.jpg,False,True
Take Product,Inside citizen put ahead official receive.,Clothing,Apple,2074,2131,14,img751.jpg,False,False
Guy Product,Decide talk door hold issue significant.,Sports,Generic,994,1078,24,img752.jpg,False,False
Mrs Product,Here democratic top sister film head pull.,Beauty,Apple,841,956,45,img753.jpg,True,False
Despite Product,Yard measure again dream even century population.,Clothing,Apple,2270,2350,41,img754.jpg,False,False
Plan Product,No policy huge fill end hold letter.,Sports,Adidas,844,1004,7,img755.jpg,True,True
Let Product,Form easy no look.,Clothing,Adidas,2309,2329,25,img756.jpg,False,False
Later Product,See world catch large order agree site.,Clothing,Generic,2839,3008,40,img757.jpg,False,False
Top Product,Break Mr father media.,Electronics,Nike,2471,2652,49,img758.jpg,False,False
Teach Product,Source turn apply.,Electronics,Generic,535,678,22,img759.jpg,True,True
Begin Product,Sign determine wait friend.,Clothing,Samsung,128,313,33,img760.jpg,False,False
Call Product,Name concern official media begin civil.,Clothing,Samsung,623,781,5,img761.jpg,False,True
Anything Product,Boy doctor course ready.,Sports,Generic,1083,1163,17,img762.jpg,False,False
Too Product,Money purpose message see government population.,Clothing,Adidas,1740,1811,46,img763.jpg,True,False
Parent Product,Dream wall hard.,Electronics,Apple,140,275,14,img764.jpg,True,False
Every Product,Environment indicate option say just never.,Clothing,Nike,242,257,4,img765.jpg,False,False
Day Product,Really include suffer yard.,Beauty,Nike,1375,1436,49,img766.jpg,True,False
Into Product,Forget fall employee.,Home,Adidas,663,812,39,img767.jpg,True,True
Various Product,Owner trip even program should.,Home,Samsung,187,343,3,img768.jpg,False,True
