name,description,category,brand,price,old_price,stock,image,is_available,is_featured
Rich Product,For south level across maintain.,Electronics,Nike,416,502,11,img769.jpg,False,False
Fill Product,Which argue avoid better green page job recent.,Sports,Generic,2880,3029,23,img770.jpg,False,False
Girl Product,Pay fall federal beat.,Home,Adidas,677,763,45,img771.jpg,False,False
Sometimes Product,Actually radio child peace behavior establish.,Sports,Nike,2738,2818,35,img772.jpg,True,False
Life Product,Job everyone national good morning serve which.,Beauty,Samsung,2122,2171,10,img773.jpg,False,False
Economic Product,Soldier box suggest day ask student.,Beauty,Generic,1645,1753,25,img774.jpg,True,True
Machine Product,Part how fear mind pull yourself skill.,Beauty,Nike,1627,1718,50,img775.jpg,True,True
Manager Product,Building father issue myself company.,Sports,Samsung,334,396,23,img776.jpg,True,True
Do Product,Size most face also hour eat.,Electronics,Adidas,1379,1545,14,img777.jpg,False,False
Here Product,Talk collection investment participant major foreign such science.,Beauty,Adidas,2656,2806,49,img778.jpg,True,True
Protect Product,Away smile forget measure window cut himself.,Home,Generic,1033,1092,13,img779.jpg,True,True
Thought Product,Magazine stay travel speech likely security citizen goal.,Home,Nike,2774,2846,39,img780.jpg,False,True
Himself Product,Seat mention radio teach strong high scene.,Beauty,Adidas,2586,2634,2,img781.jpg,True,False
Pay Product,Yet place magazine small.,Electronics,Nike,2978,3056,9,img782.jpg,True,False
Quality Product,President like everyone pay son majority.,Sports,Samsung,235,272,16,img783.jpg,True,True
Investment Product,Nature service purpose.,Beauty,Apple,2625,2741,17,img784.jpg,False,False
Community Product,Better attention audience opportunity fact stock.,Electronics,Generic,232,344,13,img785.jpg,False,True
About Product,House water put better capital sense.,Sports,Generic,2943,3026,33,img786.jpg,True,False
Free Product,Street hold term century bring.,Clothing,Apple,1419,1448,35,img787.jpg,True,False
Should Product,Court either blood organization tax tax.,Electronics,Nike,2132,2217,37,img788.jpg,True,False
Throughout Product,Mr statement event school campaign most on.,Electronics,Apple,2637,2821,47,img789.jpg,False,True
Open Product,International collection event.,Sports,Generic,2720,2784,39,img790.jpg,True,False
Contain Product,Current always feel woman allow value together.,Beauty,Adidas,330,461,25,img791.jpg,True,True
Moment Product,Theory bit agreement front face.,Clothing,Apple,70,195,42,img792.jpg,True,False
Most Product,Stay finish teacher person near Congress necessary five.,Sports,Generic,147,271,44,img793.jpg,True,False
Commercial Product,Certainly their agreement good commercial.,Sports,Generic,264,289,35,img794.jpg,True,False
Listen Product,History different three project attention already beat between.,Home,Nike,2322,2342,28,img795.jpg,False,False
Hair Product,Knowledge second become be research.,Home,Samsung,2532,2633,21,img796.jpg,False,True
Half Product,Company manager teach century spring such board.,Home,Adidas,1598,1791,30,img797.jpg,False,True
Congress Product,Later compare executive world avoid modern though get.,Beauty,Generic,232,277,31,img798.jpg,True,False
Opportunity Product,Still crime model.,Sports,Adidas,2034,2163,28,img799.jpg,True,True
Political Product,Charge expert old certainly.,Home,Adidas,2674,2692,48,img800.jpg,False,False
Religious Product,Which prove special five friend.,Sports,Adidas,781,965,10,img801.jpg,False,True
Maybe Product,Well what role actually miss.,Clothing,Samsung,1694,1801,13,img802.jpg,False,True
Three Product,Affect garden she wear follow.,Beauty,Samsung,1179,1359,16,img803.jpg,True,True
Culture Product,Put forget movement church indeed season brother tree.,Clothing,Samsung,2317,2419,32,img804.jpg,False,True
All Product,Animal four lose.,Home,Apple,1793,1955,42,img805.jpg,True,True
Peace Product,Have forget develop offer amount camera up.,Clothing,Samsung,1490,1510,29,img806.jpg,True,False
Check Product,Alone area should federal stay.,Home,Apple,866,1035,5,img807.jpg,False,False
Party Product,Tough do represent activity.,Beauty,Apple,1960,2040,15,img808.jpg,True,True
Control Product,Reduce kind instead.,Sports,Apple,297,473,50,img809.jpg,True,False
Decide Product,Scientist tax thought while.,Electronics,Adidas,2384,2499,11,img810.jpg,True,True
These Product,Short industry exactly simple.,Clothing,Apple,1731,1792,36,img811.jpg,True,False
Imagine Product,Of glass compare address idea.,Beauty,Generic,1672,1766,26,img812.jpg,True,True
Black Product,Bag me father list unit.,Sports,Generic,1930,2062,22,img813.jpg,True,False
I Product,Film sign model party nation.,Electronics,Samsung,2478,2614,15,img814.jpg,True,True
Sure Product,Common then people structure name course try.,Beauty,Samsung,279,341,42,img815.jpg,False,True
Truth Product,Win drive open consumer field student us.,Electronics,Samsung,1015,1152,43,img816.jpg,False,True
Type Product,Size charge state option woman.,Sports,Generic,1366,1398,1,img817.jpg,True,True
Military Product,Yard only teach week through family.,Sports,Generic,2772,2938,14,img818.jpg,True,True
Service Product,Thousand not write plan wonder.,Sports,Generic,863,937,37,img819.jpg,True,False
Protect Product,Walk return ago.,Electronics,Generic,1408,1507,1,img820.jpg,True,True
Information Product,Last writer history short guess.,Electronics,Apple,794,979,23,img821.jpg,False,False
Part Product,Discuss in government short wish why.,Electronics,Nike,2885,2909,46,img822.jpg,False,False
Movement Product,Far upon less beyond avoid herself fish child.,Electronics,Adidas,1497,1593,39,img823.jpg,False,False
Especially Product,Herself there view.,Sports,Nike,2573,2682,43,img824.jpg,True,True
With Product,Lose night allow clear.,Home,Adidas,806,890,22,img825.jpg,True,True
Shake Product,Company boy success recognize get four garden across.,Home,Generic,620,685,41,img826.jpg,False,False
Protect Product,Response machine again though eye may.,Home,Generic,2829,2841,22,img827.jpg,True,False
Author Product,Anyone article rule sell fall.,Clothing,Generic,1837,1942,29,img828.jpg,True,True
Thus Product,Yourself name over this capital.,Home,Nike,1691,1880,34,img829.jpg,True,False
Soon Product,Hear case part single behavior beautiful process.,Home,Generic,2967,3011,37,img830.jpg,False,True
Return Product,Wear help suggest marriage argue wife interest.,Beauty,Generic,2535,2548,10,img831.jpg,True,False
Sound Product,Seven final sort.,Sports,Samsung,1010,1107,19,img832.jpg,True,False
Sometimes Product,Our culture hour box.,Beauty,Nike,1733,1749,38,img833.jpg,True,False
Stock Product,Mission carry green.,Electronics,Samsung,2450,2537,15,img834.jpg,True,False
Describe Product,Actually Mrs suddenly.,Beauty,Samsung,573,694,8,img835.jpg,False,True
Type Product,Ever animal place door lead Mrs truth fall.,Beauty,Generic,144,322,12,img836.jpg,False,True
From Product,Raise onto thought speak end.,Home,Generic,2788,2869,40,img837.jpg,True,False
Grow Product,Including traditional trouble conference.,Clothing,Generic,54,237,31,img838.jpg,True,False
Quite Product,Hold their happen.,Electronics,Adidas,1895,2061,6,img839.jpg,True,False
Light Product,Glass final event indicate.,Beauty,Samsung,1497,1608,13,img840.jpg,False,False
Which Product,Law structure statement bed determine.,Beauty,Samsung,2326,2506,25,img841.jpg,False,True
Across Product,Us toward family enough.,Clothing,Samsung,591,752,21,img842.jpg,True,False
Cut Product,Scene list expect win middle need.,Clothing,Adidas,1272,1454,32,img843.jpg,False,False
Kitchen Product,Around research else.,Home,Apple,2371,2414,14,img844.jpg,False,False
Gun Product,Shoulder table seat too join or.,Electronics,Apple,799,949,10,img845.jpg,False,False
Walk Product,Sometimes be difference.,Electronics,Generic,865,925,31,img846.jpg,True,False
Sign Product,Less especially land stay number.,Sports,Apple,1303,1322,30,img847.jpg,False,True
Look Product,Seat operation expect seat remain.,Clothing,Generic,2245,2424,13,img848.jpg,False,False
Since Product,Region probably base tax know.,Sports,Apple,757,819,32,img849.jpg,True,False
Class Product,Debate crime different up chair person lay.,Clothing,Samsung,1916,2087,7,img850.jpg,True,False
All Product,Glass moment though more.,Clothing,Apple,2934,2999,36,img851.jpg,True,True
Ball Product,Scene space local throughout.,Sports,Nike,817,993,5,img852.jpg,False,True
Tonight Product,Ready high amount order hair rate force.,Home,Apple,2642,2780,27,img853.jpg,True,True
Like Product,Center lead indeed relationship consumer usually range plant.,Clothing,Adidas,1810,1939,35,img854.jpg,True,True
But Product,Performance few hard town imagine size around.,Sports,Apple,1310,1371,1,img855.jpg,True,True
Very Product,Accept I job whose inside stuff idea.,Home,Generic,2753,2875,46,img856.jpg,False,False
Really Product,Before peace statement machine.,Clothing,Nike,1987,2163,30,img857.jpg,True,True
Million Product,Network race challenge point live.,Beauty,Generic,2972,3162,0,img858.jpg,False,False
Season Product,Building size board rich perform say deal.,Sports,Adidas,1038,1133,13,img859.jpg,True,False
Firm Product,Community Mr break do note.,Sports,Nike,1857,1932,30,img860.jpg,True,True
Partner Product,Author history all ground.,Sports,Apple,1302,1485,48,img861.jpg,False,True
Security Product,Race film other mission.,Clothing,Generic,136,235,17,img862.jpg,False,False
Lay Product,Point than company.,Sports,Samsung,2753,2772,46,img863.jpg,False,True
Fish Product,Local side participant war.,Electronics,Samsung,2332,2516,2,img864.jpg,True,False
Language Product,Boy mouth think.,Sports,Adidas,440,626,27,img865.jpg,True,True
Upon Product,Candidate station do might chance.,Home,Apple,335,370,29,img866.jpg,True,True
Community Product,Three people few beautiful firm ten.,Sports,Adidas,999,1013,47,img867.jpg,False,True
Man Product,Science ever issue.,Sports,Samsung,2414,2437,30,img868.jpg,True,False
Tree Product,Cold throw tree get and.,Home,Generic,2355,2504,24,img869.jpg,True,True
Leg Product,About father into.,Electronics,Nike,1241,1392,49,img870.jpg,True,True
Final Product,Feel indicate four something.,Beauty,Apple,2039,2093,42,img871.jpg,True,True
Peace Product,Figure successful hard wear list type these.,Home,Generic,837,1020,48,img872.jpg,False,True
Generation Product,For stay then become old Democrat.,Clothing,Apple,674,738,32,img873.jpg,False,False
Month Product,Travel low worry since.,Home,Samsung,2705,2877,19,img874.jpg,False,False
Still Product,Sort fight under her direction before small.,Sports,Generic,2278,2310,46,img875.jpg,True,False
Process Product,Education director cost manage whom act.,Clothing,Adidas,1194,1289,25,img876.jpg,True,True
Technology Product,Despite avoid red buy with.,Clothing,Generic,1833,1996,14,img877.jpg,False,False
Window Product,No owner risk consumer enter.,Sports,Generic,2111,2192,46,img878.jpg,False,True
Fight Product,Office indeed open me no morning.,Clothing,Samsung,2209,2266,50,img879.jpg,False,False
Drug Product,Travel risk federal program trip.,Electronics,Generic,2160,2178,36,img880.jpg,False,False
Certain Product,Your white night cultural know.,Electronics,Nike,1274,1457,35,img881.jpg,True,False
Them Product,Certain order list develop art hard.,Sports,Apple,1857,1899,22,img882.jpg,False,False
Loss Product,Your sort every former great.,Home,Samsung,278,380,23,img883.jpg,False,True
Child Product,Dog as nice visit sort by capital.,Electronics,Nike,78,149,40,img884.jpg,True,False
Nothing Product,Evening drug be media.,Sports,Generic,2670,2758,33,img885.jpg,True,True
Garden Product,Mean resource behind.,Home,Generic,827,957,43,img886.jpg,True,True
Discover Product,Well certainly produce raise myself.,Beauty,Generic,2476,2626,10,img887.jpg,True,False
True Product,Yes phone good from weight.,Electronics,Nike,1782,1967,33,img888.jpg,True,False
Hit Product,Street plan green enough raise return thing artist.,Sports,Samsung,1788,1932,49,img889.jpg,False,True
Knowledge Product,During how century why full.,Beauty,Generic,1265,1348,49,img890.jpg,False,False
Hair Product,Customer reason require drug.,Sports,Generic,640,839,6,img891.jpg,True,True
Determine Product,Official law decade seek eat ten.,Sports,Adidas,112,182,47,img892.jpg,True,False
Travel Product,Though bring address east.,Beauty,Nike,2132,2210,41,img893.jpg,False,True
Admit Product,Human should state all herself decision.,Clothing,Adidas,868,884,22,img894.jpg,False,False
Beyond Product,Behind nature my study way style difficult.,Home,Generic,1882,1915,30,img895.jpg,False,False
Morning Product,By coach material ago.,Electronics,Generic,212,409,4,img896.jpg,True,False
Two Product,Newspaper outside space rather institution.,Sports,Generic,2601,2706,3,img897.jpg,False,False
Those Product,Form begin world than drop.,Electronics,Nike,295,431,23,img898.jpg,False,True
Hope Product,Follow once worry mother.,Sports,Nike,2296,2425,16,img899.jpg,True,True
Popular Product,Unit move tree.,Beauty,Apple,696,849,28,img900.jpg,False,False
Throw Product,Allow sure ahead site.,Home,Samsung,2003,2198,36,img901.jpg,True,True
Meet Product,Off two oil edge beat kind world.,Electronics,Samsung,1593,1756,20,img902.jpg,True,False
Likely Product,Possible get important fish race office democratic.,Electronics,Adidas,133,272,25,img903.jpg,True,True
Nature Product,Know economy moment join health.,Beauty,Samsung,2298,2459,15,img904.jpg,False,True
Now Product,Edge yes push notice how tree notice.,Clothing,Samsung,290,339,9,img905.jpg,False,False
Once Product,Personal carry miss.,Home,Adidas,908,1074,37,img906.jpg,False,True
Instead Product,Former court theory kind suggest movie wall road.,Sports,Generic,1603,1664,48,img907.jpg,True,False
Citizen Product,Computer full pretty continue eat world.,Electronics,Generic,1515,1637,3,img908.jpg,True,True
So Product,Turn why maybe dog himself.,Clothing,Samsung,2178,2278,14,img909.jpg,False,True
Help Product,Create service sometimes recent hotel.,Beauty,Nike,2628,2783,50,img910.jpg,True,True
Act Product,Answer provide firm popular couple.,Sports,Apple,1368,1414,19,img911.jpg,False,False
Follow Product,National my term today trouble quite.,Home,Generic,1742,1857,11,img912.jpg,False,True
Culture Product,Join store morning ask official any.,Beauty,Apple,1790,1819,1,img913.jpg,False,False
Different Product,Almost decade lot civil building really whom issue.,Beauty,Generic,1807,1864,17,img914.jpg,False,False
Environment Product,Article cold stage music business morning listen.,Clothing,Nike,1040,1052,23,img915.jpg,False,True
Around Product,Understand sport step answer receive determine nearly.,Clothing,Generic,1158,1187,25,img916.jpg,False,True
Suggest Product,General bad official.,Electronics,Samsung,2659,2681,31,img917.jpg,True,True
Organization Product,Couple building brother mind far month.,Clothing,Samsung,1282,1313,14,img918.jpg,False,True
Official Product,Modern idea wrong yet measure deal.,Home,Apple,455,536,23,img919.jpg,True,True
Stay Product,Professor community line.,Home,Nike,2237,2270,5,img920.jpg,False,False
Collection Product,Son yet campaign population.,Beauty,Apple,1995,2119,40,img921.jpg,False,False
Party Product,Lead suddenly likely but.,Electronics,Nike,1155,1166,6,img922.jpg,True,False
Partner Product,Authority church compare Mrs fall fact forget.,Sports,Generic,2309,2349,21,img923.jpg,False,True
Capital Product,Cup question have daughter.,Sports,Nike,1614,1686,3,img924.jpg,True,True
Happy Product,Agent character center.,Beauty,Apple,1260,1315,26,img925.jpg,True,False
Reason Product,Most bag actually general back special over.,Sports,Samsung,136,265,9,img926.jpg,False,False
Author Product,Cold few represent color point in push.,Sports,Generic,2889,3075,18,img927.jpg,False,True
Which Product,Spring interesting group government officer.,Sports,Generic,82,163,32,img928.jpg,True,False
Woman Product,Director out onto ask board test walk.,Beauty,Samsung,2666,2749,41,img929.jpg,True,False
Through Product,Tv hear us give Republican adult president that.,Beauty,Nike,2801,2963,35,img930.jpg,False,True
Weight Product,Toward high pick age million street degree accept.,Clothing,Apple,238,262,13,img931.jpg,False,False
Want Product,Identify art operation effort win lay follow culture.,Beauty,Nike,409,587,17,img932.jpg,True,False
Sort Product,Town some pretty beyond.,Electronics,Nike,2130,2215,21,img933.jpg,True,True
Board Product,Thought stand film require above.,Sports,Generic,1277,1394,5,img934.jpg,True,True
Public Product,Center throughout daughter rock view body.,Home,Adidas,2517,2701,36,img935.jpg,True,False
Get Product,Music sometimes even difficult along those prepare.,Clothing,Samsung,88,225,38,img936.jpg,True,True
Natural Product,Including because effect large.,Beauty,Nike,475,621,23,img937.jpg,False,True
Yet Product,Film smile garden pattern law TV.,Sports,Adidas,2342,2460,3,img938.jpg,False,False
Mouth Product,Themselves huge laugh region.,Electronics,Apple,1408,1605,0,img939.jpg,False,True
Job Product,Today former best western significant up investment.,Clothing,Generic,229,403,19,img940.jpg,False,False
Might Product,Then evening inside stage.,Clothing,Apple,402,421,39,img941.jpg,True,True
Summer Product,Without prove responsibility TV learn.,Beauty,Generic,2600,2746,37,img942.jpg,False,False
North Product,Include adult year myself.,Clothing,Apple,1559,1601,1,img943.jpg,True,True
Model Product,Model world late others bad kid.,Clothing,Nike,1130,1279,2,img944.jpg,True,False
Give Product,Democrat start understand crime anything personal.,Beauty,Adidas,1597,1668,25,img945.jpg,True,True
Really Product,Fact memory head trip discover expert alone.,Electronics,Generic,2355,2404,49,img946.jpg,False,False
Effect Product,Account while price front.,Beauty,Adidas,890,1020,17,img947.jpg,True,False
Movement Product,Forward fast purpose yard few campaign.,Beauty,Apple,1991,2004,26,img948.jpg,False,False
Thank Product,Republican remember draw truth.,Sports,Samsung,2581,2623,16,img949.jpg,True,True
Occur Product,Since produce admit professor why space building.,Home,Adidas,1783,1926,8,img950.jpg,False,True
Her Product,Staff capital particular.,Home,Apple,2816,2895,50,img951.jpg,True,True
Hope Product,Who to floor yes number quite.,Clothing,Nike,1915,2011,37,img952.jpg,False,True
Four Product,Society artist father station science plant read.,Clothing,Adidas,883,1004,10,img953.jpg,True,True
Defense Product,Grow approach member something parent piece.,Electronics,Apple,1056,1126,16,img954.jpg,True,True
Read Product,Morning especially sister.,Electronics,Apple,1013,1140,36,img955.jpg,False,True
Trade Product,More news small him generation another.,Home,Adidas,1655,1808,39,img956.jpg,True,True
Movie Product,Any power season discover.,Home,Samsung,2352,2394,9,img957.jpg,True,True
Else Product,Bit investment pass sing feeling enjoy many.,Sports,Apple,1294,1488,14,img958.jpg,True,False
Care Product,Board around before as quality career reach.,Sports,Nike,1137,1279,29,img959.jpg,True,False
Maintain Product,Effort eight design enter voice.,Clothing,Generic,2549,2670,36,img960.jpg,False,True
Agree Product,Learn remain teacher source.,Beauty,Generic,1639,1706,14,img961.jpg,True,True
Especially Product,Remain fine glass him eight service argue.,Electronics,Adidas,1183,1314,12,img962.jpg,True,True
Trouble Product,Tend win enough lawyer.,Clothing,Adidas,2405,2595,26,img963.jpg,False,False
Note Product,Kid indeed share structure attack high.,Electronics,Samsung,2943,3078,45,img964.jpg,False,True
Congress Product,Necessary pull foreign.,Clothing,Apple,2014,2157,15,img965.jpg,False,False
North Product,Base show field level story.,Electronics,Nike,501,549,0,img966.jpg,True,False
Condition Product,Without pattern size into show.,Electronics,Nike,2830,2915,0,img967.jpg,True,False
Significant Product,Somebody student hot.,Beauty,Adidas,2232,2378,43,img968.jpg,False,True
Need Product,Night front nature quickly world night research population.,Sports,Samsung,2606,2748,34,img969.jpg,True,True
Agency Product,Mean soon throw turn fill method behind.,Home,Nike,1145,1161,48,img970.jpg,True,False
Much Product,Difference worry moment upon.,Clothing,Samsung,705,753,10,img971.jpg,False,False
Stage Product,Site receive institution executive grow.,Home,Apple,833,877,17,img972.jpg,True,False
Cell Product,Think morning who avoid.,Sports,Generic,502,650,5,img973.jpg,False,False
Home Product,Cost go black.,Electronics,Samsung,2845,2984,46,img974.jpg,True,False
Seven Product,Ago card responsibility.,Clothing,Nike,1083,1152,1,img975.jpg,False,False
Career Product,Its peace across last after cold analysis.,Sports,Apple,1019,1080,8,img976.jpg,False,True
Trip Product,Increase provide finally best.,Sports,Adidas,717,882,13,img977.jpg,False,False
Student Product,Describe which look effort.,Beauty,Generic,881,1074,39,img978.jpg,False,False
White Product,Money become according check join.,Electronics,Generic,1104,1231,23,img979.jpg,False,True
Out Product,Operation yeah ready one.,Beauty,Apple,898,1047,11,img980.jpg,False,True
Skin Product,Character tree idea else surface alone.,Electronics,Samsung,262,417,48,img981.jpg,False,True
Must Product,Several sign full offer local charge security.,Sports,Generic,1136,1282,28,img982.jpg,True,False
Today Product,Like partner son yeah really.,Home,Adidas,2563,2751,29,img983.jpg,True,False
Safe Product,Road able around view technology.,Home,Adidas,322,350,4,img984.jpg,True,True
Owner Product,Drop PM arm movement note director trip.,Sports,Generic,76,110,46,img985.jpg,True,True
Response Product,As history turn total offer door.,Beauty,Adidas,592,609,49,img986.jpg,True,True
Full Product,Beyond world community accept table could.,Home,Adidas,82,238,19,img987.jpg,True,False
Movement Product,Adult herself visit foreign skill.,Home,Nike,1104,1271,43,img988.jpg,False,True
Medical Product,World sure glass guy big writer.,Home,Apple,2459,2618,36,img989.jpg,False,True
Positive Product,Four science suggest for.,Clothing,Apple,2025,2098,18,img990.jpg,True,True
Lose Product,Mouth idea candidate first.,Beauty,Adidas,2751,2790,2,img991.jpg,True,True
Plan Product,Record wrong responsibility discuss single.,Home,Generic,1349,1428,7,img992.jpg,True,False
Spring Product,Where know such movie major current.,Beauty,Generic,615,765,29,img993.jpg,False,True
View Product,Ever doctor address usually wish.,Beauty,Adidas,1890,2061,25,img994.jpg,True,True
Event Product,Fill collection firm way baby.,Clothing,Generic,1754,1916,23,img995.jpg,True,False
Glass Product,Step figure half necessary central.,Electronics,Generic,846,951,43,img996.jpg,False,True
Among Product,Building as write hour.,Home,Apple,966,995,21,img997.jpg,False,True
Member Product,Argue inside sometimes parent government matter cold.,Electronics,Generic,2508,2561,10,img998.jpg,True,True
Too Product,One what look raise thing reach stand.,Beauty,Apple,212,318,21,img999.jpg,False,False
